username;date;retweets;favorites;text;geo;mentions;hashtags;id;permalink
montgomery_kam;19/11/2016 15:59;1;1;@neverletyoupart I was diagnosed with anorexia, OCD, depression ptsd and general anxiety disorder #endthestigma #shelleyduvall;;@neverletyoupart;#endthestigma #shelleyduvall;8.00E+17;https://twitter.com/montgomery_kam/status/799884817181442048
autumndro;19/11/2016 10:18;0;1;Today I was diagnosed with PTSD long road ahead but I got this;;;;8.00E+17;https://twitter.com/autumndro/status/799798863594946561
rainbowpiranha;19/11/2016 05:44;0;0;I was diagnosed with PTSD (again, but from something else), I quit my job, and my grandmother died. It can only go up from here, right?;;;;8.00E+17;https://twitter.com/rainbowpiranha/status/799729952312725504
luminousnebulae;18/11/2016 00:51;0;7;Fuck it. I'm just gonna be honest. I was diagnosed with severe PTSD a few years ago. I'm not gonna end up in the hospital again. Fuck no!;;;;7.99E+17;https://twitter.com/luminousnebulae/status/799293982081740800
ask_experts;16/11/2016 05:42;0;0;I was recently diagnosed with PTSD - post traumatic stress disorder. What strategies and supports are useful? What are your experiences?;;;;7.99E+17;https://twitter.com/ask_experts/status/798642457634181120
makeupmomma4;16/11/2016 00:51;0;0;Today i was diagnosed with panic disorder with agoraphobia and ptsd . Its emotional but we all have mountains to climb.;;;;7.99E+17;https://twitter.com/makeupmomma4/status/798569140927594496
politikcat;16/11/2016 00:31;0;0;@politikcat years later, I was diagnosed with severe, life-threatening #autoimmune disorders, #BPD , social #anxiety and #PTSD .;;@politikcat;#autoimmune #bpd #anxiety #ptsd;7.99E+17;https://twitter.com/politikcat/status/798564018332061697
ptsdqueer;14/11/2016 10:09;0;1;I was diagnosed with PTSD about. Year ago, the result of childhood sexual trauma #ptsd #queermentalhealth;;;#ptsd #queermentalhealth;7.98E+17;https://twitter.com/ptsdqueer/status/797984883163308032
livelifelovatic;12/11/2016 08:04;0;2;@YuriLowenthal I was diagnosed with PTSD a few months ago, and one of the ways I talked about it was because of you. So, thank you. <3;;@YuriLowenthal;;7.97E+17;https://twitter.com/livelifelovatic/status/797228473786007553
jacob_jen828;11/11/2016 21:23;0;0;My mother knows that I was raped as a teenager and was diagnosed with PTSD . She still voted for Trump to protect h pic.twitter.com/Pjq0CkbYb5;;;;7.97E+17;https://twitter.com/jacob_jen828/status/797067181364248576
nate15181;10/11/2016 23:34;0;0;@GodfreyElfwick I was literally diagnosed with PTSD today. I didn't have it 2 days ago. I am emotionally handicapped thanks to Trump.;;@GodfreyElfwick;;7.97E+17;https://twitter.com/nate15181/status/796737900599615488
notnertia;10/11/2016 23:10;0;0;@notnertia disgusting. awful emotional abuse on me and each other. i was diagnosed with ptsd and depression caused by long term;;@notnertia;;7.97E+17;https://twitter.com/notnertia/status/796731681310851072
LVCarlos933;10/11/2016 12:38;0;0;@8NewsNow Help the people who have mental illness take them to a hospital not jail! I was diagnosed with PTSD , major depression and anxiety!;;@8NewsNow;;7.97E+17;https://twitter.com/LVCarlos933/status/796572794389549056
IntimateEyeInc;10/11/2016 05:56;0;0;@IAmJeffEmmerson @AllenFrancesMD I was  diagnosed with ADHD, BPD, GAD, PTSD , and Panic disorder through a question list;;@IAmJeffEmmerson @AllenFrancesMD;;7.96E+17;https://twitter.com/IntimateEyeInc/status/796471514392621056
WyattsMom71511;10/11/2016 04:28;0;0;@Cristin_E I was recently diagnosed with PTSD because of my abusive ex. So, I hear ya.;;@Cristin_E;;7.96E+17;https://twitter.com/WyattsMom71511/status/796449452110348288
ChrisBuendia;09/11/2016 22:14;0;0;I was just diagnosed with ptsd .;;;;7.96E+17;https://twitter.com/ChrisBuendia/status/796355348231753728
LVA334;09/11/2016 03:48;0;1;@QueerInBC Yes, very true! I didn't get diagnosed with PTSD until I was 20. Only in the past year have I learned that I have CPTSD.;;@QueerInBC;;7.96E+17;https://twitter.com/LVA334/status/796076834370842624
EmmaLouiseWebb3;09/11/2016 03:44;0;0;@emmerdale totally get you giving nico ptsd , i was diagnosed with it after a fire killed 3 girls who lived next door to me when i was a kid;;@emmerdale;;7.96E+17;https://twitter.com/EmmaLouiseWebb3/status/796076018075320321
lmiiles;07/11/2016 22:05;0;1;I was diagnosed with ptsd two years ago today y'all #yippie;;;#yippie;7.96E+17;https://twitter.com/lmiiles/status/795628208494411776
Zaftiu;07/11/2016 15:42;0;0;I was diagnosed with PTSD , Major Depressive Disorder, and Social Anxiety.;;;;7.96E+17;https://twitter.com/Zaftiu/status/795531917466759168
KIMMlSO;07/11/2016 12:58;0;3;5) i was diagnosed with bipolar disorder and ptsd;;;;7.95E+17;https://twitter.com/KIMMlSO/status/795490641631477760
NorthernPeasant;07/11/2016 06:24;0;3;@questions2make I didn't get therapy until my 20s when I was diagnosed with PTSD @Chunkychick10;;@questions2make @Chunkychick10;;7.95E+17;https://twitter.com/NorthernPeasant/status/795391485575315457
truemira;06/11/2016 09:13;0;0;I was diagnosed with PTSD so I was triggered by everything and often.;;;;7.95E+17;https://twitter.com/truemira/status/795071668993609728
alyssjanderson;05/11/2016 11:47;0;2;@Ninjettey @tweetmesohard @ptsdUS @ptsdPLUS @ptsdVS 7 and 10 for me but I had insomnia years before I was diagnosed with PTSD .;;@Ninjettey @tweetmesohard @ptsdUS @ptsdPLUS @ptsdVS;;7.95E+17;https://twitter.com/alyssjanderson/status/794748003185815552
dog_flac;05/11/2016 07:26;0;0;@lnteIIigence I wasn't diagnosed with depression but I was depressed and suffering/ still am from PTSD after a car accident and ever since-;;@lnteIIigence;;7.95E+17;https://twitter.com/dog_flac/status/794682361258582018
lwood8682;04/11/2016 05:52;0;0;@AntMiddleton333 @Jasonfox1976 I was diagnosed with PTSD after an extremely traumatic event for me this year #mental strength from fitness.;;@AntMiddleton333 @Jasonfox1976;#mental;7.94E+17;https://twitter.com/lwood8682/status/794296235096231939
AlexLeah13;03/11/2016 04:34;0;2;3 years ago this week, I was diagnosed with MST related PTSD . It's amazing to see how far I've come and how far I have to go in healing;;;;7.94E+17;https://twitter.com/AlexLeah13/status/793914285508308992
J_BeezyFoSheezy;02/11/2016 23:43;0;0;I was just diagnosed with PTSD after my incident at church, I can't go anywhere alone except school or work bc i have a certain routune;;;;7.94E+17;https://twitter.com/J_BeezyFoSheezy/status/793840991488778240
ProSanctuary;02/11/2016 03:01;0;0;I was first diagnosed with #PTSD in 1997, after suffering for 5 years after leaving the #Navy . Blog: http:// ow.ly/uAlJ305Kp51 pic.twitter.com/dEa689Cxgm;;;#ptsd #navy;7.94E+17;https://twitter.com/ProSanctuary/status/793528380046073856
DogWish;01/11/2016 07:45;0;0;'My name is Mircea and I was blessed when I called Bob the first time. I was diagnosed with military PTSD ,... http:// fb.me/1uP04RDKl;;;;7.93E+17;https://twitter.com/DogWish/status/793237572793139200
ictcowgrrl;31/10/2016 08:48;0;0;@TheOrangutanian @shondarhimes @jaketapper For domestic violence survivors as well. I was diagnosed with PTSD thanks to abusive childhood.;;@TheOrangutanian @shondarhimes @jaketapper;;7.93E+17;https://twitter.com/ictcowgrrl/status/792890848392286208
Niquewxg;30/10/2016 21:33;6;1;I also explained that I was recently diagnosed with PTSD because I found my brother dead in our tub and the cop told me get over it.;;;;7.93E+17;https://twitter.com/Niquewxg/status/792721109552603136
SlothBoston;28/10/2016 12:11;0;1;Hmmm but the prime age to be diagnosed with any mental illness is 18-25 and I was diagnosed with PTSD @age 4. So let's keep hearing it https:// twitter.com/running_shoes4 7/status/791840039810453504 ;;@age;;7.92E+17;https://twitter.com/SlothBoston/status/791854918701244416
Valerieisdown;27/10/2016 18:45;0;0;(Btw I'm not a lying hoe and I was diagnosed with severe depression and ptsd by my psychologist when I was at college hospital 2 years ago.);West Whittier, CA;;;7.92E+17;https://twitter.com/Valerieisdown/status/791591658420776964
JoshOlfert;27/10/2016 12:14;5;88;I'm in love with my life now. But it was only 6 years ago I was diagnosed with Depression and PTSD . There is light at the end of the tunnel!;;;;7.91E+17;https://twitter.com/JoshOlfert/status/791493196941365248
melancholia_x;27/10/2016 10:06;4;21;How long ago I was diagnosed with : ED - 10 yrs PTSD - 7 yrs Depression - 7 yrs Anxiety - 7 yrs BPD - 3 yrs SO DONT TELL ME ITLL GET BETTER;;;;7.91E+17;https://twitter.com/melancholia_x/status/791461115851055104
_andreaalina;27/10/2016 03:36;0;1;2016 has been a shitty ass year for me. I was hospitalized, had severe SI, went through a break up, got diagnosed with PTSD , and much more.;;;;7.91E+17;https://twitter.com/_andreaalina/status/791362927819304960
halfhort;25/10/2016 05:13;0;0;@Wangtimeeee @ReflexHalo I was diagnosed with PTSD this morning;;@Wangtimeeee @ReflexHalo;;7.91E+17;https://twitter.com/halfhort/status/790662479068164096
giveawayflabby;24/10/2016 20:27;0;0;I was diagnosed with PTSD and if you can't respect the fact that I don't want you speeding when I'm in the car, let me out.;;;;7.91E+17;https://twitter.com/giveawayflabby/status/790530125158715392
electricpoop;24/10/2016 03:05;0;0;@stillgray I was diagnosed with it years ago. If they're getting PTSD from twitter they've been sheltered to the point of mental abuse.;;@stillgray;;7.90E+17;https://twitter.com/electricpoop/status/790267918626000896
ashlynn_strange;23/10/2016 23:45;1;0;And proud of it! Been using ganja since i was diagnosed with ADHD, Bipolar, Depression, Anxiety, PTSD , and Extreme Bone Pain. An I'm Happy. pic.twitter.com/2H6OHe7lwd;;;;7.90E+17;https://twitter.com/ashlynn_strange/status/790217625896947712
DrewsJulianna;23/10/2016 05:36;0;0;@JRhodesPianist ..when I was a toddler. I too have been diagnosed with PTSD and struggle with anxiety and depression. Apart from....;;@JRhodesPianist;;7.90E+17;https://twitter.com/DrewsJulianna/status/789943634250625024
richtorkz;23/10/2016 02:36;0;0;Anonymous said: i was recently diagnosed with Ptsd but i have no idea what that means. Can you explain it... https:// tmblr.co/ZagE8q2Djo5aN;;;;7.90E+17;https://twitter.com/richtorkz/status/789898220650524672
KeikoTakamura;22/10/2016 13:08;0;0;@cuteordeath I was diagnosed with PTSD when I was 18. Take care of yourself in healthy ways, understand your triggers, communicate them (1);;@cuteordeath;;7.90E+17;https://twitter.com/KeikoTakamura/status/789694861054271492
robert_jagneaux;20/10/2016 22:20;0;0;@realDonaldTrump Hello Mr trump my name is Robert jagneaux and I have been out of work sense 2012 after I was diagnosed with ptsd;;@realDonaldTrump;;7.89E+17;https://twitter.com/robert_jagneaux/status/789109033600819201
supersania;20/10/2016 10:51;0;26;Society tells me that I should keep mental illness a secret. I don't agree. Today I was diagnosed with PTSD and dissociative disorder;;;;7.89E+17;https://twitter.com/supersania/status/788935561713098753
tgwcw___;20/10/2016 07:19;0;0;@URBVNMGC mine has since about 7, something traumatic happened to me and I was diagnosed with some kind of ptsd;;@URBVNMGC;;7.89E+17;https://twitter.com/tgwcw___/status/788882215459446785
BRI_to_the_BLEI;20/10/2016 05:09;0;0;@BobbiLParish I was diagnosed with BPD and PTSD , and my therapist told me to never mention my BPD. The stigma is intense.;;@BobbiLParish;;7.89E+17;https://twitter.com/BRI_to_the_BLEI/status/788849684546744324
flightwit;20/10/2016 02:46;0;0;My answer to I was just diagnosed with PTSD . What do I do? URL quora.com/I-was-just-dia gnosed-with-PTSD-What-do-I-do/answer/Capt-Tom-Bunn?srid=GG0o ;;;;7.89E+17;https://twitter.com/flightwit/status/788813474608648192
Deserved2BLoved;14/10/2016 23:17;0;0;My name is Robyn Clay and I was diagnosed with paranoid schizophrenia bipolar manic and PTSD about 5 yrs ago#teammentalillness #teamMAPA;;;#teammentalillness #teammapa;7.87E+17;https://twitter.com/Deserved2BLoved/status/786949108988678145
reacheverygen;14/10/2016 17:13;0;1;I used to think it was weak to admit I was diagnosed with #PTSD considering I was a man and successful.. but I'm stronger for embracing it;;;#ptsd;7.87E+17;https://twitter.com/reacheverygen/status/786857525392048128
MisseyJanexxx;14/10/2016 12:30;0;0;So at my appt today I was asked if I have ever been diagnosed with PTSD , I said I've never been evaluated before...;;;;7.87E+17;https://twitter.com/MisseyJanexxx/status/786786285444747268
TX_Seattle_Girl;14/10/2016 08:04;0;2;@gopikashine I was diagnosed with PTSD at age 7.....sometimes adults don't know how damaging a single thing can be for a child!;;@gopikashine;;7.87E+17;https://twitter.com/TX_Seattle_Girl/status/786719224773300225
griffin_jennie;12/10/2016 07:49;0;0;3 yrs ago I was diagnosed with PTSD . Ppl think I may b bipolar. I spend my time denyin my issues. 2 tired. hurting & nt as easy 2 hide it;;;;7.86E+17;https://twitter.com/griffin_jennie/status/785990644133167104
PTSDchat_org;12/10/2016 04:17;1;2;#PTSD #PTSDchat PTSD how to cope - I was diagnosed with ptsd , and general anxiety, it has totally taken over my... http:// ow.ly/zP3k505lvhz;;;#ptsd #ptsdchat;7.86E+17;https://twitter.com/PTSDchat_org/status/785937298240274432
anxietx;12/10/2016 04:05;0;3;Generalized Anxiety Disorder was the term I was diagnosed with -- #USMarine #GeneralizedAnxietyDisorder #AnxietX #anxiety #stress #PTSD;;;#usmarine #generalizedanxietydisorder #anxietx #anxiety #stress #ptsd;7.86E+17;https://twitter.com/anxietx/status/785934372255961090
EleHall74;11/10/2016 22:09;0;1;True thing, I was diagnosed with PTSD , I'm not good when Im made to jump/scared. I'm highly likely to attack any scary clowns that appear.;;;;7.86E+17;https://twitter.com/EleHall74/status/785844826076053504
Cait_taylorr;11/10/2016 08:29;0;0;i was diagnosed with bipolar disorder 1, depression, anxiety and ptsd , but i don't let it define me https:// twitter.com/phil500/status /785601760115187712 ;Houston, TX;;;7.86E+17;https://twitter.com/Cait_taylorr/status/785638372253413378
KateDahls;11/10/2016 06:34;0;3;I was diagnosed with PTSD 10 years ago. And depression. Finally sought help this year. It's nice to wake up smiling. #WorldMentalHealthDay;;;#worldmentalhealthday;7.86E+17;https://twitter.com/KateDahls/status/785609531296452608
eisyak_;11/10/2016 05:13;0;0;at the age of 15 i was diagnosed with PTSD and depression and received psychiatric help for over a year;;;;7.86E+17;https://twitter.com/eisyak_/status/785589012450910208
rkambury;11/10/2016 02:54;0;5;I took Zoloft for depression when I was 8 years old. Was re-diagnosed with it, anxiety, and PTSD in 2010. #WorldMentalHealthDay;;;#worldmentalhealthday;7.86E+17;https://twitter.com/rkambury/status/785554170560581632
sassykaaay;11/10/2016 01:48;1;4;Two years ago I was diagnosed with bipolar disorder, PTSD and anxiety. And I am still happy. #WorldMentalHealthDay;;;#worldmentalhealthday;7.86E+17;https://twitter.com/sassykaaay/status/785537471832399872
foleopurba;11/10/2016 01:09;0;2;Mm. I was diagnosed with ptsd , social anxiety, generalized anxiety disorderand depression. My ptsd 's the worst.;;;;7.86E+17;https://twitter.com/foleopurba/status/785527779450318848
Self_Made_Mena;10/10/2016 23:04;0;2;It's #WorldMentalHealthDay . Here's my story: Starting at age 16 I was diagnosed with PTSD , later also as Bipolar II, Borderline, DID & more.;;;#worldmentalhealthday;7.85E+17;https://twitter.com/Self_Made_Mena/status/785496331200651265
karmandabynes;10/10/2016 22:53;0;0;@michellevisage I was diagnosed with PTSD that resulted in depression and a panic disorder. In high school, I didn't even know that --;;@michellevisage;;7.85E+17;https://twitter.com/karmandabynes/status/785493552029573121
KattFunny;10/10/2016 21:01;0;27;#WorldMentalHealthDay Thing happened beyond my control. Subsequently, I was diagnosed with #PTSD a few years ago. Am still being treated.;;;#worldmentalhealthday #ptsd;7.85E+17;https://twitter.com/KattFunny/status/785465336665550849
BS_Intolerant;10/10/2016 20:16;0;0;I can remember after my SAP service incl various firefights I was diagnosed with PTSD . It's now been reduced to this shit. Disgusting https:// twitter.com/EverydaySexism /status/785428900302229504 ;;;;7.85E+17;https://twitter.com/BS_Intolerant/status/785454021947625472
roswynnejones;10/10/2016 19:53;2;14;In 2000 I was diagnosed with PTSD after war reporting. 16 yrs later, still grateful every day I wake up feeling well #WorldMentalHealthDay;;;#worldmentalhealthday;7.85E+17;https://twitter.com/roswynnejones/status/785448245803814912
leighjbarnard;10/10/2016 18:01;1;9;Two years ago I was diagnosed with #PTSD Some days I feel meh but am so grateful for the support of friends and family #WorldMentalHealthDay;Landford, England;;#ptsd #worldmentalhealthday;7.85E+17;https://twitter.com/leighjbarnard/status/785419911539621888
HeyMollyB;09/10/2016 08:53;0;2;@kellyoxford I was diagnosed with #PTSD and sexual abuse/rape are a big part of it. #notokay;California, USA;@kellyoxford;#ptsd #notokay;7.85E+17;https://twitter.com/HeyMollyB/status/784919686496387072
wiIIxherondaIe;08/10/2016 19:10;2;3;eventually, 14 y/o me couldn't process the trauma and I was diagnosed with clinical depression, anxiety and mild PTSD at 15. #NotOkay;;;#notokay;7.85E+17;https://twitter.com/wiIIxherondaIe/status/784712480375316480
mcleodamberrae;08/10/2016 09:31;0;0;9 years ago this month I was diagnosed with #PTSD today I just realized it's another day in the books. Happy monthly birthday to me! #TLE;;;#ptsd #tle;7.85E+17;https://twitter.com/mcleodamberrae/status/784566774427680769
fatt_anorexic;06/10/2016 04:02;0;0;remember when i was diagnosed with ptsd and nobody cared l o l;;;;7.84E+17;https://twitter.com/fatt_anorexic/status/783759406252961793
lemmyrose;06/10/2016 00:38;0;3;When I was diagnosed with PTSD and Anxiety like 5 years ago, I thought that meant I'd have a shitty life but I'm actually pretty happy now.;;;;7.84E+17;https://twitter.com/lemmyrose/status/783708057150758912
AisforPooty_;05/10/2016 21:25;0;0;I was diagnosed with Bipolar Disorder 1 with severe depression and anxitey on top of PTSD in 2014.;;;;7.84E+17;https://twitter.com/AisforPooty_/status/783659379908149249
Sifichick;05/10/2016 16:23;0;0;@brittania_ doctor about them. I know what I speak of I have been diagnosed with PTSD from abuse I suffered when I was a child. I get;;@brittania_;;7.84E+17;https://twitter.com/Sifichick/status/783583482433900545
LVCarlos933;05/10/2016 11:12;0;0;@8NewsNow @timkaine @GovPenceIN I was diagnosed with PTSD as an adult due to the trauma induced by molestation by the priest!;;@8NewsNow @timkaine @GovPenceIN;;7.84E+17;https://twitter.com/LVCarlos933/status/783505123007877120
L_A_C_E_;05/10/2016 02:01;0;0;What PTSD is http:// mykecole.com/what-ptsd-is/ Beautiful I was diagnosed with this approx 1 yr ago. Lived with for years.;;;;7.83E+17;https://twitter.com/L_A_C_E_/status/783366475713085440
TheWordBowl;05/10/2016 01:58;0;1;I hope things are dif now. When diagnosed with PTSD the 2nd time & put on a med cat I was told I would be released & lose everything. https:// twitter.com/CanadianForces /status/783363292802809856 ;;;;7.83E+17;https://twitter.com/TheWordBowl/status/783365738228842500
justtrynacuddle;04/10/2016 22:44;0;0;@TaylorManhart the mental scars are hardest. It doesn't end when you make it out alive. Trust me. I was diagnosed with chronic PTSD in April;;@TaylorManhart;;7.83E+17;https://twitter.com/justtrynacuddle/status/783316820933611524
drkatcoder;04/10/2016 21:26;0;1;When I was 26 I was diagnosed with Major Depressive Disorder and PTSD . I was sleeping 14 hours a day, 30 pounds... http:// fb.me/31oTbgEOt;;;;7.83E+17;https://twitter.com/drkatcoder/status/783297211849248769
drkatcoder;04/10/2016 21:20;0;0;When I was 26 I was diagnosed with Major Depressive Disorder and PTSD . I was sleeping 14 hours a day, 30 pounds... http:// fb.me/596HT24Hc;;;;7.83E+17;https://twitter.com/drkatcoder/status/783295808980463616
Dozgooddaz;04/10/2016 21:04;0;0;Mr.Trump i was diagnosed with PTSD on friday i vote for you ! Donald Trump draws backlash for comments on PTSD https:// twitter.com/i/moments/7829 94173943218176 ;;;;7.83E+17;https://twitter.com/Dozgooddaz/status/783291594422284288
AEDLING;04/10/2016 12:41;1;1;In January, I was diagnosed with #PTSD . Every single day has been a struggle since. Every. Single. Day.;Phoenix, AZ;;#ptsd;7.83E+17;https://twitter.com/AEDLING/status/783165222257238016
GuirandWilner;04/10/2016 12:22;0;0;@realDonaldTrump I was diagnosed with PTSD and I don't have a weak born in me.....;;@realDonaldTrump;;7.83E+17;https://twitter.com/GuirandWilner/status/783160313294315520
bradlaplante;04/10/2016 09:16;0;3;I was diagnosed with PTSD after a difficult upbringing from years of parental abuse. Veterans go through far worse.;;;;7.83E+17;https://twitter.com/bradlaplante/status/783113518870622208
twoclaws2;04/10/2016 08:09;0;0;@maradacy @washingtonpost I was diagnosed with PTSD no one talked about it and no one tried to figure it out he does;;@maradacy @washingtonpost;;7.83E+17;https://twitter.com/twoclaws2/status/783096725363843072
DesireeAaron;04/10/2016 08:05;1;1;#PTSD While I never had the honor to serve my Country, I was diagnosed with PTSD /TBI due to workplace violence. #REMEMBERBENGHAZI;;;#ptsd #rememberbenghazi;7.83E+17;https://twitter.com/DesireeAaron/status/783095620710047744
MomGOTgame;04/10/2016 07:31;0;0;Retweeted Honey Bunny ( @HillYes1 ): I was diagnosed with PTSD after my father died. It's not about strength or... http:// fb.me/2zru5h9Pd;;@HillYes1;;7.83E+17;https://twitter.com/MomGOTgame/status/783087086035271680
HillYes1;04/10/2016 07:00;53;89;I was diagnosed with PTSD after my father died. It's not about strength or weaknesses. At all. https:// twitter.com/i/moments/7829 94173943218176 ;;;;7.83E+17;https://twitter.com/HillYes1/status/783079374409039873
livelifelovatic;04/10/2016 05:41;0;1;@taraplatt @YuriLowenthal A project that means everything to me, since I was diagnosed with PTSD , non combat. Thank you, Yuri. <3;;@taraplatt @YuriLowenthal;;7.83E+17;https://twitter.com/livelifelovatic/status/783059409555554304
NoorinDC;04/10/2016 05:29;0;1;I'm not a vet but i was diagnosed with PTSD in 2014. We are the strongest people you will ever meet, trump should be ashamed;;;;7.83E+17;https://twitter.com/NoorinDC/status/783056283771416576
SkatinOnThin1ce;04/10/2016 04:54;0;0;I'm a combat veteran of 2 tours to Iraq.. I was diagnosed with #PTSD in 2013. I have ZERO issue with what Trump said, and agree w/ him on it;;;#ptsd;7.83E+17;https://twitter.com/SkatinOnThin1ce/status/783047646743293953
JSOC_DF;04/10/2016 04:09;0;0;I was diagnosed with service-connected PTSD (2011). Nothing @realDonaldTrump said bothered me. What he knows is anecdotal like most people.;;@realDonaldTrump;;7.83E+17;https://twitter.com/JSOC_DF/status/783036220024684544
orwellian_babe;04/10/2016 04:07;0;0;I was diagnosed with severe PTSD 8 years ago & struggle with it daily. I agree with this vet's statement & found nothing offensive in DJT's. https:// twitter.com/JackPosobiec/s tatus/783031562552041472 ;;;;7.83E+17;https://twitter.com/orwellian_babe/status/783035727365935104
lahederahelix;04/10/2016 03:47;0;1;I've never discussed this, but I will today. 3 years ago I had 2 traumatic events happen to me within 3 months & I was diagnosed with PTSD .;;;;7.83E+17;https://twitter.com/lahederahelix/status/783030800941846528
lucky10_13;04/10/2016 03:33;0;0;I lost my husband when I was 6 months pregnant w our son. I was then diagnosed with #PTSD 4 Donald to call me weak b/c of it is disgusting;;;#ptsd;7.83E+17;https://twitter.com/lucky10_13/status/783027147707387904
SoSofieFatale;04/10/2016 03:11;1;12;I was diagnosed with PTSD 25 years ago and it still affects me. I assure you, I'm the strongest girl ever.;;;;7.83E+17;https://twitter.com/SoSofieFatale/status/783021765232627713
Number7307;04/10/2016 02:57;0;0;@realDonaldTrump I was diagnosed with PTSD and I am stronger than you will ever be! #DumpTrump vote @HillaryClinton;;@realDonaldTrump @HillaryClinton;#dumptrump;7.83E+17;https://twitter.com/Number7307/status/783018070658998272
hill55willie;04/10/2016 02:04;0;0;I was diagnosed with PTSD from serving in Vietnam So I take this personally WHO IN THE HELL gave him the Right to Disparage Veterans https:// twitter.com/DesMchlmcgnn/s tatus/782998445531561985 ;;;;7.83E+17;https://twitter.com/hill55willie/status/783004702451441664
brassfannibal;04/10/2016 00:40;1;38;I was diagnosed with ptsd and it is a struggle everyday. Those of you out there who are also struggling ARE the strong ones;;;;7.83E+17;https://twitter.com/brassfannibal/status/782983782903054337
MeagMonroe;01/10/2016 02:17;0;16;I was diagnosed with clinical depression, anxiety and ptsd . That hasn't stopped me from moving forward, bettering my life. It's just a bump;;;;7.82E+17;https://twitter.com/MeagMonroe/status/781920955786375168
singsparkles;30/09/2016 04:20;0;0;@shnrvr82 you are very lucky and I look up to people like you. I was diagnosed with PTSD from basically being abused by every black male;;@shnrvr82;;7.82E+17;https://twitter.com/singsparkles/status/781589585679835136
lovebird28;29/09/2016 09:56;0;0;@atensnut I was fired anyway. I spent 40 years as an ICU nurse and suddenly my career was gone. I have been diagnosed with PTSD by the VA.;;@atensnut;;7.81E+17;https://twitter.com/lovebird28/status/781311624930070528
HobieOtt;28/09/2016 12:34;0;1;@kriscrittah I was diagnosed with BPD and PTSD-C yesterday. Wishing you the best of luck with your recovery.;;@kriscrittah;;7.81E+17;https://twitter.com/HobieOtt/status/780989065021849600
WomanlyWoman;28/09/2016 03:11;0;0;Crying because I know exactly how Skylar on #TDJakesShow feels. I was diagnosed with #Bipolar at age 15 and #PTSD and #OCD later.;;;#tdjakesshow #bipolar #ptsd #ocd;7.81E+17;https://twitter.com/WomanlyWoman/status/780847319948333056
