username;date;retweets;favorites;text;geo;mentions;hashtags;id;permalink
ptsdforum;23/09/2015 11:40;0;0;New Here-I was diagnosed with Generalized Anxiety Disorder, the therapist told me I hav URL myptsd.com/c/threads/new- here.56420/ ;;;;6.47E+17;https://twitter.com/ptsdforum/status/646529535148695552
ptsdforum;14/12/2014 03:58;1;0;Anxiety Overload 14 years ago I was diagnosed with Vertical Diplopia or as more commonly known Vertical Double visi URL myptsd.com/c/threads/anxi ety-overload.49506/ ;;;;5.44E+17;https://twitter.com/ptsdforum/status/543857526870384640
ptsdforum;13/07/2014 11:57;0;0;New To This And Hoping For Change: Hello, I was diagnosed with PTSD, anxiety , depression and I am disabled wit... http:// bit.ly/1mX8OV3;;;;4.88E+17;https://twitter.com/ptsdforum/status/488170236135235584
ptsdforum;02/05/2014 18:18;0;0;Ptsd Nos And Anxiety And Or Social Anxiety : As I recall, When I was diagnosed with PTSD I was diagnosed with ... http:// bit.ly/PWEVoR;;;;4.62E+17;https://twitter.com/ptsdforum/status/462174161842868225
ptvnormi;13/07/2015 16:54;0;0;i was diagnosed with depression and anxiety last july 2013 what.the.fuck;;;;6.21E+17;https://twitter.com/ptvnormi/status/620516549036670976
ptxem;24/08/2015 11:13;0;2;if you guys didnt know I was diagnosed with depression and severe anxiety and that band, has given me so much hope and love even though-;;;;6.36E+17;https://twitter.com/ptxem/status/635651071520677888
pumpkinkurt;01/01/2016 01:41;0;3;1) got diagnosed with depression & anxiety 2) figured out i was ace 3) actually told someone i was ace (thx emma);;;;6.83E+17;https://twitter.com/pumpkinkurt/status/682617622995705856
pupositive;14/09/2016 22:08;0;1;[CW] Now 6 years after I was diagnosed with depression, social anxiety & bulimia (recently also BPD) I am in a much better place mentally;;;;7.76E+17;https://twitter.com/pupositive/status/776059942994374656
Purekatherine21;09/03/2016 13:55;0;0;I wish I was never diagnosed with anxiety . I'm sick of either feeling nervous or ready to cry every second of the day.;;;;7.07E+17;https://twitter.com/Purekatherine21/status/707444649795911681
Purekatherine21;09/03/2016 10:16;0;0;I was diagnosed with anxiety disorder. I recently leave my job early due to my worries.;;;;7.07E+17;https://twitter.com/Purekatherine21/status/707389556383813632
PURPLEPlLLS;23/03/2016 20:24;0;2;I was diagnosed with depression and anxiety . Hate leaving my bed and being surrounded by people. I know how Justin feels.;;;;7.13E+17;https://twitter.com/PURPLEPlLLS/status/712616101868355584
Purplishink;13/08/2014 02:57;0;0;Encouraged me to seek help. I did. I was diagnosed with clinical depression & anxiety disorder. I began talk therapy & was prescribed an;;;;4.99E+17;https://twitter.com/Purplishink/status/499268438582652928
purrblind;29/01/2015 06:41;0;1;Ive been diagnosed with a General Anxiety Disorder since i was 3 years old. It used to be a lot easier http:// instagram.com/p/yai2YenCxj/;;;;5.61E+17;https://twitter.com/purrblind/status/560568427476443137
PussyOoverdose_;26/11/2014 11:42;0;0;I was diagnosed with Anxiety;;;;5.37E+17;https://twitter.com/PussyOoverdose_/status/537451411597176832
putridhuman;09/07/2015 23:16;0;1;@QUESADILLABABY @_whoredinary i was diagnosed with manic depression and severe anxiety disorder when i was 10 and my dad still refused to;;@QUESADILLABABY @_whoredinary;;6.19E+17;https://twitter.com/putridhuman/status/619163329559310336
putridhuman;27/01/2015 10:22;4;9;#TweetLikeALocal I have crippling social anxiety that isn't real/ I was never diagnosed with !! let's abuse prescription drugs!! no homo;;;#tweetlikealocal;5.60E+17;https://twitter.com/putridhuman/status/559899252516601856
PxrkJxmin95;25/10/2016 07:49;0;0;// I was diagnosed with severe generalized anxiety and this is so true its sad. URL justcutthebullshit.com/home/2016/10/2 0/anxiety-is-an-invalid-excuse ;;;;7.91E+17;https://twitter.com/PxrkJxmin95/status/790701784776007680
pxssyagb;20/07/2014 09:57;0;0;I have bad anxiety like 2 years ago I was diagnosed with a panic disorder & I really can't handle being here rn | #MTVHottest Ariana Grande;;;#mtvhottest;4.91E+17;https://twitter.com/pxssyagb/status/490676847613841409
pyroclasticgrub;23/09/2014 04:37;0;0;@AliLawrence @sarah_connors When I was diagnosed with melanoma, hockey became a distraction from my anxiety . Def a change for better!;;@AliLawrence @sarah_connors;;5.14E+17;https://twitter.com/pyroclasticgrub/status/514151532766306304
qemetria;11/09/2016 18:57;0;1;nobody's gonna read this but i feel better writing things down, so here we go... i was diagnosed with moderate to severe anxiety disorder+;;;;7.75E+17;https://twitter.com/qemetria/status/774924729207525377
QueenAwakened;24/05/2016 12:03;0;1;@MsZiggySunshine @FirstGentleman @spiritualpoet_ At one point, I was diagnosed with ADD, anxiety , and chronic low-grade depression.;;@MsZiggySunshine @FirstGentleman @spiritualpoet_;;7.35E+17;https://twitter.com/QueenAwakened/status/734958097115041792
QueenJess5678;28/01/2016 07:35;0;1;I was diagnosed with anxiety in late 2015 and although it was difficult, I realized that I was not alone. #BellLetsTalk #BellLetsTalk;;;#bellletstalk #bellletstalk;6.92E+17;https://twitter.com/QueenJess5678/status/692491233332195328
QueenModeratrix;31/10/2014 22:49;0;0;I confess that my insomnia & anxiety have me bummed out. I was diagnosed with PTSD dysthymia & I'm trying to beat it without meds #exhausted;;;#exhausted;5.28E+17;https://twitter.com/QueenModeratrix/status/528197196051935233
queenreggz;16/08/2016 09:47;0;0;i was diagnosed with anxiety when i was 12 so when you say you have anxiety bc of everyday nervousness, I wanna throw myself off a bridge;;;;7.65E+17;https://twitter.com/queenreggz/status/765364392611512325
Quincyworld;31/03/2016 01:03;1;1;Anxiety is the Worse shit Ever! I was diagnosed with panic Attacks when I was 17 they put me on Zannys. It helps but I don't wanna be on it;;;;7.15E+17;https://twitter.com/Quincyworld/status/715222925167734784
r3nsk1;21/01/2016 10:12;0;0;I was diagnosed with anxiety today. This is my prescription. pic.twitter.com/UViYeSWmVH;;;;6.90E+17;https://twitter.com/r3nsk1/status/689993975592280065
RaavenWith2As;21/02/2016 02:14;0;1;I was diagnosed with depression in 2012 , so xans really help me out a lot . Other wise anxiety attacks will kick my ass at night smh;;;;7.01E+17;https://twitter.com/RaavenWith2As/status/701107604664090624
rach3lathedisco;05/08/2016 20:18;0;1;#ReasonsWhyWeLoveShawn I was diagnosed with severe anxiety in the 4th grade and for the past 3 years Shawn has gotten me me through it;;;#reasonswhyweloveshawn;7.62E+17;https://twitter.com/rach3lathedisco/status/761536896321355776
RachaelSoluri;06/11/2015 11:41;0;1;@TurkushDelight I was diagnosed with an anxiety disorder. But the toughest pill to swallow is pride!;;@TurkushDelight;;6.62E+17;https://twitter.com/RachaelSoluri/status/662474752032948224
rachelgibbens;17/09/2015 23:47;0;0;It was roughly this time last year that I was officially diagnosed with depression and anxiety . I https:// instagram.com/p/7vL6WCzJFc/;;;;6.45E+17;https://twitter.com/rachelgibbens/status/644538218428428288
Rachelkane_15;10/08/2015 04:58;0;0;@Niamh_sull eh, I actually do have anxiety , I was diagnosed by a doctor I was diagnosed with anxiety early last year so get your facts right;;@Niamh_sull;;6.30E+17;https://twitter.com/Rachelkane_15/status/630483394388983808
RachellyWheaton;28/01/2016 02:39;1;1;When I was a teenager, I was diagnosed with PTSD. The fear, anxiety , and depression felt like it would be never-ending. #BellLetsTalk;;;#bellletstalk;6.92E+17;https://twitter.com/RachellyWheaton/status/692416709014208512
rachnp89;08/05/2014 04:06;0;0;Kudos for sharing RT @scATX : Here's what I wrote last year the day I was diagnosed with anxiety and depression: http:// jessicawluther.com/2013/01/30/on- depression-my-own/ ;;@scATX;;4.64E+17;https://twitter.com/rachnp89/status/464134082289356800
radical_train;10/11/2014 18:09;0;0;isnt it funny how i was diagnosed with anxiety at 3 but ive never gotten any treatment for it whatsoever;;;;5.32E+17;https://twitter.com/radical_train/status/531750446218899456
Rajaldo07;17/07/2015 13:11;0;0;Anxiety Disorder. Never understood it until I was diagnosed with it after my grandpa was admitted and passed away not long after.;;;;6.22E+17;https://twitter.com/Rajaldo07/status/621910140145393664
RantingRelation;15/10/2015 21:44;0;1;I was diagnosed with major depressive disorder and severe anxiety . It never fully goes away.;;;;6.55E+17;https://twitter.com/RantingRelation/status/654653957952827394
rapperjello96;19/11/2015 12:00;0;1;I feel ya twinnie, when I was diagnosed with depression and anxiety things got fucked up. Though I do refuse to take medication;;;;6.67E+17;https://twitter.com/rapperjello96/status/667190720923459585
raspyguitarist;17/02/2015 09:01;0;0;@bcofbrad @AcaciaBrinley guess what, I was diagnosed with social anxiety when I was 10, by a doctor. I know what it's like, so;;@bcofbrad @AcaciaBrinley;;5.67E+17;https://twitter.com/raspyguitarist/status/567488999644987394
Ratchet_Tips101;27/09/2014 13:39;0;0;So I was diagnosed with Schizo-effective, major depressive disorder, anxiety , paranoia, and borderline personality disorder.;;;;5.16E+17;https://twitter.com/Ratchet_Tips101/status/515737563710357505
ratedsivan;04/11/2014 07:10;0;0;@sadkinks i was diagnosed with social anxiety and anxiety and adhd and add and ocd.,, i think i know what im talking about;;@sadkinks;;5.29E+17;https://twitter.com/ratedsivan/status/529410379596984320
ratedsivan;04/11/2014 07:07;0;0;@cyberfreakshow i was diagnosed with anxiety nd i take medication for it but then she goes nd posts nudes all the time & claims she has it..;;@cyberfreakshow;;5.29E+17;https://twitter.com/ratedsivan/status/529409509933211649
ratedsivan;02/11/2014 06:46;0;1;i was diagnosed with social anxiety ! saying i get scared to go on stage isnt the same thing! pic.twitter.com/YCRRtaZ3Ay;;;;5.29E+17;https://twitter.com/ratedsivan/status/528679422921277440
ratstrash;20/10/2016 04:59;0;0;its been over 6 years since i was diagnosed with depression and anxiety disorder and there have been loads of difficulties in my journey;;;;7.89E+17;https://twitter.com/ratstrash/status/788847114096869377
Raurasaurus17;28/01/2016 07:46;0;0;@LeafsFan_93 its a good cause I was diagnosed with Generalised Anxiety Disorder when i was 19;;@LeafsFan_93;;6.92E+17;https://twitter.com/Raurasaurus17/status/692493900737560576
ravetreephan;30/11/2015 07:51;0;0;@TheTumblrPosts agreed I was diagnosed with social anxiety recently along with autitory hypersensitivity. Neither is cute.;;@TheTumblrPosts;;6.71E+17;https://twitter.com/ravetreephan/status/671114351076487168
ravimendis;11/05/2014 19:05;0;0;@CharitySANE Yeah. After being diagnosed with #mentalillness @CMFTNHS I was prescribed #risperdal . #sideeffects included chronic anxiety !;Manchester, England;@CharitySANE @CMFTNHS;#mentalillness #risperdal #sideeffects;4.65E+17;https://twitter.com/ravimendis/status/465447578734436352
rayjacksnn;15/05/2016 01:58;0;0;You are not alone, I was diagnosed with anxiety and depression last year. We'll get through it! One step at a time https:// twitter.com/nataliciousfun k/status/731541740113399808 ;;;;7.32E+17;https://twitter.com/rayjacksnn/status/731544278694912001
RayTay0321;26/06/2016 08:57;1;1;Day 3: although I was diagnosed with severe anxiety /depression, I am trying to put myself out there to make friends instead of punishing;;;;7.47E+17;https://twitter.com/RayTay0321/status/746870049835712512
RayTay0321;03/04/2016 08:05;0;1;I was diagnosed with severe anxiety and depression last night. Sorry to the people who think I'm too negative. Now you know why.;;;;7.16E+17;https://twitter.com/RayTay0321/status/716416331440988161
readyforwars;24/04/2015 03:53;0;2;i can't believe i was falsely diagnosed with social anxiety i only wanted it for attention!;;;;5.91E+17;https://twitter.com/readyforwars/status/591329014905589760
Reah5SOS;03/10/2015 03:45;1;2;https:// twitter.com/maiumgiris/sta tus/649657395262660608  My idols are amazing! I was diagnosed with anxiety at 15, these boys became my reason to carry on;;;;6.50E+17;https://twitter.com/Reah5SOS/status/650033841642586113
RealCalmHarmony;11/08/2015 12:28;0;0;I mean although I was diagnosed with Generalized Anxiety , I do get anxious or have panic attacks in situations pertaining to +;;;;6.31E+17;https://twitter.com/RealCalmHarmony/status/630958825143672832
RealLaurenStone;28/10/2015 20:37;0;0;I don't often speak about my mental health, so forgive me for the long tweet. When I was 14 I was diagnosed with severe anxiety and;;;;6.59E+17;https://twitter.com/RealLaurenStone/status/659348315847442434
reallyJSON;11/12/2015 10:44;0;0;1) I was diagnosed with Bipolar disorder and Anxiety disorder at the age of 11. One of the youngest cases in my area.;;;;6.75E+17;https://twitter.com/reallyJSON/status/675144206692818944
realwlstories;09/08/2016 23:24;0;0;Meet @shauntelfit When I was 13 I was diagnosed with anxiety & depression. I relied on food to help me cope. I... http:// fb.me/2kdTXuyyw;;@shauntelfit;;7.63E+17;https://twitter.com/realwlstories/status/763033194820145152
realwlstories;09/08/2016 23:24;0;0;Meet shauntelfit When I was 13 I was diagnosed with anxiety & depression. I relied on food to URL instagram.com/p/BI5JL1xASgH/;;;;7.63E+17;https://twitter.com/realwlstories/status/763033189090791424
rebecal_26;30/04/2016 13:01;0;0;so I was diagnosed with anxiety and depression...;;;;7.26E+17;https://twitter.com/rebecal_26/status/726275305653059584
rebeccapardy;29/01/2015 05:38;3;1;#BellLetsTaIk because it's been 3 years since I was diagnosed with anxiety and I can proudly say I'm no longer medicated!;;;#bellletstaik;5.61E+17;https://twitter.com/rebeccapardy/status/560552491062800385
RedditSelf;11/11/2014 03:11;0;0;Getting into therapy: I was diagnosed with clinical depression and generalized anxiety disorder two years ago,... http:// bit.ly/10RzxZY;;;;5.32E+17;https://twitter.com/RedditSelf/status/531886988253618176
RedWhiteAndPoor;25/05/2016 14:30;0;1;I was diagnosed with anxiety and depression a long time ago. The dr wasn't specific but I'm pretty sure I have bipolar depression. Haha;;;;7.35E+17;https://twitter.com/RedWhiteAndPoor/status/735357347070148609
RedWhiteAndPoor;19/04/2014 03:50;0;1;@bridlesnbits I was diagnosed with serve anxiety and depression. I don't really know how to describe it. Other then I always feel worried,;;@bridlesnbits;;4.57E+17;https://twitter.com/RedWhiteAndPoor/status/457244858130776065
Reesiebabygirl;09/02/2016 16:43;0;0;A year ago I was diagnosed with an anxiety disorder.;;;;6.97E+17;https://twitter.com/Reesiebabygirl/status/696977614649614336
ReidGenni;15/04/2014 09:03;0;0;@Bookish_Bunny laughter is the best medicine. I forgot to laugh a lot when I was first diagnosed with depression and anxiety .;;@Bookish_Bunny;;4.56E+17;https://twitter.com/ReidGenni/status/455873979484344320
reinventlovve;18/08/2015 20:27;0;1;my dad literally forgot that I was diagnosed with anxiety . and took medication for it I'm;;;;6.34E+17;https://twitter.com/reinventlovve/status/633616301701906432
reisbm11;24/08/2016 00:57;0;5;On today's date, I was diagnosed with anxiety disorder. Fought past it, threw the meds out, and...now we've gone full circle;;;;7.68E+17;https://twitter.com/reisbm11/status/768129968500985856
relaxrelpsedemo;11/10/2016 01:37;0;0;#WorldMentalHealthDay dont shame those with mi based on age or say theyre too young or too old, i was 12 when diagnosed with severe anxiety;;;#worldmentalhealthday;7.86E+17;https://twitter.com/relaxrelpsedemo/status/785534716346720256
ReleventXimena;04/07/2015 11:51;0;0;I am VERY sorry for the what I tweeted earlier as some of you may know i have anxiety , panic attacks, OCD, and I was diagnosed with a minor;;;;6.17E+17;https://twitter.com/ReleventXimena/status/617178785708965888
rema735;03/10/2015 02:51;0;0;Well then I was diagnosed with anxiety IBS and not the 'food' IBS. I stopped eating spicy food maybe that helped;;;;6.50E+17;https://twitter.com/rema735/status/650020356175081476
repxsed;15/08/2016 09:20;1;1;there was a strange feeling I got when I was diagnosed with anxiety & depression;;;;7.65E+17;https://twitter.com/repxsed/status/764995150519103488
Rewire09;19/02/2016 09:54;0;0;I was diagnosed with panic disorder in 1987. It's been an up & down ride. #anxiety;;;#anxiety;7.00E+17;https://twitter.com/Rewire09/status/700498754344857600
RexxieCat;11/12/2015 01:33;0;0;14. I've been diagnosed with major depression and anxiety disorder. I was told i have BPD but they can't diagnose it officially.;Maryland, USA;;;6.75E+17;https://twitter.com/RexxieCat/status/675005402237558785
RHancock19;25/04/2014 01:12;0;0;@Katybug24 I was diagnosed with anxiety disorder last month.;;@Katybug24;;4.59E+17;https://twitter.com/RHancock19/status/459379383178768384
rhi5_rhi;25/02/2015 18:21;0;0;@markiplier a little hard I was diagnosed with serve anxiety today it's been crippling me for days got the courage to recognise and treat it;;@markiplier;;5.71E+17;https://twitter.com/rhi5_rhi/status/570529016496533505
RhyleighGrace;07/09/2015 14:13;0;0;@mycowsaysmeow believe me I get the anxiety thing! I was diagnosed with anxiety when I was a kid and it can be crippling.;;@mycowsaysmeow;;6.41E+17;https://twitter.com/RhyleighGrace/status/640769952014729216
RhymesByGoose;20/02/2015 03:48;0;0;In 2006 I was diagnosed with an anxiety problem due to various reasons, one of the main reasons was my http:// instagram.com/p/zS4lIaS8zM/;;;;5.68E+17;https://twitter.com/RhymesByGoose/status/568497465156087811
RianAshleyyy;21/09/2015 11:15;4;3;wouldn't be surprised if I was diagnosed with an anxiety problem;;;;6.46E+17;https://twitter.com/RianAshleyyy/status/645798467407888384
RianSygh;01/05/2016 23:50;10;46;I was diagnosed with clinical depression and an intensive anxiety disorder in 2012, I got help bc I wanted to pursue my career seriously-;;;;7.27E+17;https://twitter.com/RianSygh/status/726801024917360641
ricci_michelle;22/03/2015 07:39;0;1;@T_MitchellK I was diagnosed with anxiety awhile ago, & I just straight asked my doctor if she'd write a therapy pet prescription & she did.;;@T_MitchellK;;5.79E+17;https://twitter.com/ricci_michelle/status/579427106880270337
rich0131;10/10/2016 23:52;0;3;Remove the stigma, ask questions and be supportive. I was diagnosed with Anxiety , help, meds & education were my key #worldmentalhealthday;Sheffield, England;;#worldmentalhealthday;7.86E+17;https://twitter.com/rich0131/status/785508245423190016
Richard_Pepper;13/01/2016 07:18;0;1;@baileyjace Mine was all I want to get a new quality of life for you when I was diagnosed with severe anxiety and I was basically like;;@baileyjace;;6.87E+17;https://twitter.com/Richard_Pepper/status/687051005754740736
rickiemccanna;05/03/2016 06:00;0;1;I was diagnosed with anxiety when I was 16, which just gave me anxiety about having anxiety;;;;7.06E+17;https://twitter.com/rickiemccanna/status/705875479866318848
riddlerharley;31/12/2014 10:01;0;0;I was diagnosed with social anxiety two years ago and you can find tons of group pics with me in them, that doesn't mean I lied;;;;5.50E+17;https://twitter.com/riddlerharley/status/550109503166091264
RightToMyBody;28/09/2015 10:41;0;0;@PepperNStardust aww hugs I was diagnosed with generalized anxiety in 2007 (was having panic attacks) but it's been a while since symptoms.;;@PepperNStardust;;6.48E+17;https://twitter.com/RightToMyBody/status/648326574144659456
rilee_toews;15/09/2016 11:06;0;2;I was diagnosed with off the charts anxiety , I find that peppermint and eucalyptus essential oil help me so much @MannyMua733;;@MannyMua733;;7.76E+17;https://twitter.com/rilee_toews/status/776255809214742529
rileigh_watson;14/12/2015 12:11;0;0;Yea not like you were THERE when I was diagnosed with anxiety or anything. You're right I'm faking it;;;;6.76E+17;https://twitter.com/rileigh_watson/status/676253039217381376
rileybubbles22;13/10/2015 03:27;1;1;@DakkaOmar I use to ask that question too. Then I was diagnosed with separation anxiety with my bed;;@DakkaOmar;;6.54E+17;https://twitter.com/rileybubbles22/status/653653348978196480
Rissa1412;18/10/2014 01:00;0;0;@RyanAlexanderD1 it's not about the cops it's like I was diagnosed with anxiety from a doc I have it all the time even when not smoking.;;@RyanAlexanderD1;;5.23E+17;https://twitter.com/Rissa1412/status/523156664476659712
rkambury;11/10/2016 02:54;0;5;I took Zoloft for depression when I was 8 years old. Was re-diagnosed with it, anxiety , and PTSD in 2010. #WorldMentalHealthDay;;;#worldmentalhealthday;7.86E+17;https://twitter.com/rkambury/status/785554170560581632
RNB215;10/10/2016 22:54;18;48;I was diagnosed with Depression/ anxiety 2 months ago. Everyday is battle but I continue to fight and seek help #WorldMentalHealthDay;;;#worldmentalhealthday;7.85E+17;https://twitter.com/RNB215/status/785493784838692864
roarZoeroar;22/02/2016 13:23;0;0;You know what? Imma just come out and say it. I was diagnosed with Bipolar 2 and general anxiety disorder.;;;;7.02E+17;https://twitter.com/roarZoeroar/status/701638360901660672
robbiekkay;14/07/2015 22:35;0;1;@Alexandra4831 I was diagnosed with it, bc I have high stress/ anxiety levels , but it actually sucks because it feels like you got no sleep;;@Alexandra4831;;6.21E+17;https://twitter.com/robbiekkay/status/620964724256018432
RobertStalcup;19/12/2015 07:27;1;0;@trillpepper that's what I was thinking, how do I get diagnosed with anxiety , show them my #StressedTweets ?;;@trillpepper;#stressedtweets;6.78E+17;https://twitter.com/RobertStalcup/status/677993652090634240
Robfan85;14/09/2015 07:22;0;0;@andi_m_m so true. I was diagnosed with my anxiety disorder in my early 20s & it's gotten better. My dad was diagnosed as bipolar in his 30s;;@andi_m_m;;6.43E+17;https://twitter.com/Robfan85/status/643203211680026625
robineggz14;11/05/2016 23:16;0;0;@hazelynn5313 umm... I was diagnosed with anxiety a few years ago and I'm not on anything. Js. They suggested it but I told them no.;;@hazelynn5313;;7.30E+17;https://twitter.com/robineggz14/status/730416210953699328
robotfucker69;12/05/2016 00:58;0;1;@SHlTZUO this is so relatable since I was diagnosed with social anxiety ahdcc;;@SHlTZUO;;7.30E+17;https://twitter.com/robotfucker69/status/730441876856135681
RobotHeartSquid;21/06/2016 00:23;0;0;@RobotHeartSquid 10 I was diagnosed with severe social anxiety when I was 9. Just the thought of being called on to go up to the board or ++;;@RobotHeartSquid;;7.45E+17;https://twitter.com/RobotHeartSquid/status/744928581537644544
rocketgirlyt;04/07/2014 21:17;0;3;I WAS DIAGNOSED WITH ANXIETY AND BIPOLAR DISEASE;;;;4.85E+17;https://twitter.com/rocketgirlyt/status/485049707803443200
romeocarballo20;11/10/2016 07:16;2;11;Last year I was diagnosed with severe anxiety , a year later I'm way better then ever. Its not bad to ask for help #WorldMentalHealthDay;;;#worldmentalhealthday;7.86E+17;https://twitter.com/romeocarballo20/status/785620171809443840
ronaIynch;15/12/2015 09:29;0;0;@scvrletwtch yeah me to, I was diagnosed with selective mutism and it gives me really bad anxiety , I could only talk to certain people+;;@scvrletwtch;;6.77E+17;https://twitter.com/ronaIynch/status/676574885221548032
Rosanna_Wood;11/04/2014 06:29;0;0;There's a huge difference between worrying and being crippling anxious, I misunderstood that myself until I was diagnosed with anxiety .;;;;4.54E+17;https://twitter.com/Rosanna_Wood/status/454385699169787904
rosebarton234;28/01/2016 09:33;1;1;#BellLetsTalk because I was diagnosed with chronic depression and an anxiety disorder at 14. And 5 years later, I'm still working on it.;;;#bellletstalk;6.93E+17;https://twitter.com/rosebarton234/status/692520719603884036
roseey_05;09/12/2014 07:50;0;0;Ever since I was diagnosed with anxiety , and put on medicine to help it, I've had phobias of literally everything.;;;;5.42E+17;https://twitter.com/roseey_05/status/542103907816992768
rosielipz;27/03/2016 14:04;0;0;I have had people leave me and now I'm afraid to have relationships. I was diagnosed with bipolar and anxiety . Your not alone @trishapaytas;;@trishapaytas;;7.14E+17;https://twitter.com/rosielipz/status/713970043470544897
rositaxpinosa;11/10/2016 00:28;0;2;#WorldMentalHealthDay it was only recently that I was 'officially diagnosed' with depression and anxiety and I'm finally trying to get help-;;;#worldmentalhealthday;7.86E+17;https://twitter.com/rositaxpinosa/status/785517457553428480
RosyTheCat;14/08/2015 15:50;0;0;i was diagnosed with anxiety disorders, mayor depression idkw, and ocd. what's next;;;;6.32E+17;https://twitter.com/RosyTheCat/status/632097019914489856
RoumRabbit;15/07/2014 09:26;0;0;I used to consider myself shy until I was diagnosed with multiple anxiety disorders now idk how much of that is actual shyness HMM;;;;4.89E+17;https://twitter.com/RoumRabbit/status/488857086344695808
rousseauuu;11/10/2015 01:53;0;12;in honour of WMHD, its been 5yrs since i was diagnosed with anxiety disorder but i've never felt stronger #WorldMentalHealthDay;;;#worldmentalhealthday;6.53E+17;https://twitter.com/rousseauuu/status/652904723113115648
RowdyFuckboy;09/12/2014 06:59;0;0;@Kendoro i feel you so hard. I was diagnosed with ADHD until they figured out it was actually generalized anxiety .;;@Kendoro;;5.42E+17;https://twitter.com/RowdyFuckboy/status/542091160026509312
Rowemanticize;09/10/2015 15:59;0;6;I was also diagnosed with clinical depression. My doctor believes I've had it for a while not and that it is what is causing my anxiety .;;;;6.52E+17;https://twitter.com/Rowemanticize/status/652392925272383488
