username;date;retweets;favorites;text;geo;mentions;hashtags;id;permalink
FairyCatStudio;26/01/2016 08:07;0;0;I was diagnosed with complex PTSD but having a diagnosis doesn't magically make life easier. #survivor #ptsd pic.twitter.com/wtLRcb8YrC;;;#survivor #ptsd;6.92E+17;https://twitter.com/FairyCatStudio/status/691774347585916928
facebookguide2;26/01/2016 02:52;0;0;RT RUfrickinrealCA #PTSD #mentalhealth #anxiety #depression I was just diagnosed with #severesomaticsymptomdisorder scared as hell;;;#ptsd #mentalhealth #anxiety #depression #severesomaticsymptomdisorder;6.92E+17;https://twitter.com/facebookguide2/status/691695273446359042
RUfrickinrealCA;26/01/2016 02:51;0;0;#PTSD #mentalhealth #anxiety #depression I was just diagnosed with #severesomaticsymptomdisorder scared as hell;Calgary, Alberta;;#ptsd #mentalhealth #anxiety #depression #severesomaticsymptomdisorder;6.92E+17;https://twitter.com/RUfrickinrealCA/status/691694923439943680
cesixus;25/01/2016 23:53;0;0;... I was diagnosed with PTSD a while back. So my sleep isn't fun at all nowadays.;;;;6.92E+17;https://twitter.com/cesixus/status/691650129300955136
AsSweetAsSin;25/01/2016 09:03;0;0;~ because of my PTSD . I'm liable to choke the living shit out of my mother for it. [[For the first time since I was diagnosed with PTSD I ~;;;;6.91E+17;https://twitter.com/AsSweetAsSin/status/691426034332405761
LCSNewsFeed;24/01/2016 00:31;0;0;I was diagnosed with war induced PTSD in '09, and I've never hit my significant other. Track Palin may well have P https:// twitter.com/MykeCole/statu s/690234615404072963 ;;;;6.91E+17;https://twitter.com/LCSNewsFeed/status/690934947222306816
ashley_potirala;23/01/2016 13:35;0;0;I was recently diagnosed with PTSD from the way my childhood and life has been when people talk to me I'm pretty... http:// fb.me/4iegNPoRM;;;;6.91E+17;https://twitter.com/ashley_potirala/status/690769883726917633
calliewriting;22/01/2016 12:02;1;8;THIS. I was diagnosed with PTSD and have never acted violently towards anyone. https:// twitter.com/mykecole/statu s/690234615404072963 ;;;;6.90E+17;https://twitter.com/calliewriting/status/690383978570850310
oncomingspork;22/01/2016 06:47;0;0;I was diagnosed with non-combat PTSD in 2009 and I have never hit anyone. https:// twitter.com/MykeCole/statu s/690234615404072963 ;;;;6.90E+17;https://twitter.com/oncomingspork/status/690304633009405952
Sectioned_;22/01/2016 04:39;0;1;@lucy_seren Yes, physical restraint can cast a long shadow. I was diagnosed with PTSD from what was done to me. Sorry it happened to you :(;;@lucy_seren;;6.90E+17;https://twitter.com/Sectioned_/status/690272580893315075
andyacr;22/01/2016 02:36;0;0;@EdBerliner Ed, it would be very easy for me to blame everyone when I was diagnosed with PTSD . It was easier to deal, and get help!;Plantation, FL;@EdBerliner;;6.90E+17;https://twitter.com/andyacr/status/690241550081757184
MykeCole;22/01/2016 02:08;168;313;I was diagnosed with war induced PTSD in '09, and I've never hit my significant other. Track Palin may well have PTSD , but he's also a dick;;;;6.90E+17;https://twitter.com/MykeCole/status/690234615404072963
AnthonyTorinoX;21/01/2016 16:11;0;0;This morning I was diagnosed with PTSD ... by a physician I was drunkenly waving a gun at. #sarahpaliniscrazy #sarahpalinlogic #JustAJoke;;;#sarahpaliniscrazy #sarahpalinlogic #justajoke;6.90E+17;https://twitter.com/AnthonyTorinoX/status/690084408905351169
joev816;21/01/2016 09:04;0;0;@DeptVetAffairs @bigricanman @NAMICommunicate I was diagnosed with PTSD and then denied PTSD claim;;@DeptVetAffairs @bigricanman @NAMICommunicate;;6.90E+17;https://twitter.com/joev816/status/689976708762574856
firesign1969;21/01/2016 07:45;1;2;I was diagnosed with PTSD over 25 years ago...will you tell me why the one thing that truly helps is illegal? @TheTHCTemple @BernieSanders;;@TheTHCTemple @BernieSanders;;6.90E+17;https://twitter.com/firesign1969/status/689956823487627265
HeathenHassid;21/01/2016 07:19;1;1;This bitch. I was diagnosed with PTSD , and yet I've somehow managed to blame my many fuck-ups on it not once. In... http:// fb.me/73eBt5IfM;;;;6.90E+17;https://twitter.com/HeathenHassid/status/689950388183810050
sextingatcostco;20/01/2016 23:25;0;3;wish i could give i was diagnosed with ptsd and my therapist says i can't as a certifiable excuse not to do something;;;;6.90E+17;https://twitter.com/sextingatcostco/status/689831209065517056
mesafama;20/01/2016 07:27;0;0;@nitpickette01 @godless_mom I was also diagnosed with ptsd and am a psych major so I'm well aware of the facets associated with PTSD thanks;;@nitpickette01 @godless_mom;;6.90E+17;https://twitter.com/mesafama/status/689590033431400448
FeministBun;18/01/2016 06:47;0;2;I haven't been too open about my evaluation results because I'm really insecure but one thing I was diagnosed with was PTSD;;;;6.89E+17;https://twitter.com/FeministBun/status/688855239798030336
LGBTDoD;17/01/2016 17:47;0;0;#ptsd #veterans Explaining My Ptsd To My Friends - I was diagnosed with PTSD a few months ago and since then ha... http:// ow.ly/3abuIl;;;#ptsd #veterans;6.89E+17;https://twitter.com/LGBTDoD/status/688658774459047936
tinkerbella5295;16/01/2016 03:41;0;0;I'm pissed my lotus flower alex and ani bracelet broke! I have not taken that off since I was diagnosed with PTSD;;;;6.88E+17;https://twitter.com/tinkerbella5295/status/688083489950953474
ForzaPapac;15/01/2016 23:40;1;6;(2) Are about a subject close to my heart. In 2012 I was diagnosed with PTSD and it's played a big part in my life since.;;;;6.88E+17;https://twitter.com/ForzaPapac/status/688022956962918400
arealstab;15/01/2016 10:27;0;1;@mistressmatisse @AblativMeatshld I realised my rape was rape when I was diagnosed with PTSD . people hide trauma from themselves too.;;@mistressmatisse @AblativMeatshld;;6.88E+17;https://twitter.com/arealstab/status/687823464196124672
bewitchyourmind;15/01/2016 07:39;0;1;I love that I was diagnosed with PTSD but I still can't get an appointment with a psychiatrist bc a bunch of rich boys and girls want;;;;6.88E+17;https://twitter.com/bewitchyourmind/status/687781005114085377
dubstepwolf1998;15/01/2016 06:03;0;2;and then I was diagnosed with ptsd at 16 after my suicidal incident. then we went to the navy hospital.;;;;6.88E+17;https://twitter.com/dubstepwolf1998/status/687756853296513024
ptsdforum;15/01/2016 01:41;1;2;Grateful To Not Be Alone-Hello. I was diagnosed with PTSD about 7-month URL myptsd.com/c/threads/grat eful-to-not-be-alone.58750/ ;;;;6.88E+17;https://twitter.com/ptsdforum/status/687690936449667073
Emeraldisle922;14/01/2016 06:23;0;2;@HealingCPTSD Yep! Who knew! I was shocked when I was diagnosed with PTSD ! I was so naive,so gullible,so trusting until I uncovered the mask;;@HealingCPTSD;;6.87E+17;https://twitter.com/Emeraldisle922/status/687399514899103744
heyabbby;14/01/2016 03:28;0;0;This is so true!!!!!! I was diagnosed with Generalized Anxiety Disorder and PTSD at 17 & 18 and URL instagram.com/p/BAfbBEdHFup/;;;;6.87E+17;https://twitter.com/heyabbby/status/687355642433044481
abbymnorman;14/01/2016 01:39;3;9;#ImNotAshamed I have seen the same therapist for seven years  since I was first diagnosed with #PTSD  and together with meds, I manage.;;;#imnotashamed #ptsd;6.87E+17;https://twitter.com/abbymnorman/status/687328216097382400
capseyes_cappy;13/01/2016 04:44;0;0;@USAFHealth Any guesses as 2 y I was diagnosed with PTSD 2 yrs ago, & not told? Learned reading health rcd copies last wk. DW/Ret E7 >21;;@USAFHealth;;6.87E+17;https://twitter.com/capseyes_cappy/status/687012386524524544
rainspirit11;13/01/2016 03:17;0;1;@Teacuppin I've been bullied so hard I was diagnosed with ptsd . Words hurt. They hurt real bad.;;@Teacuppin;;6.87E+17;https://twitter.com/rainspirit11/status/686990451803590656
Loxodonta_s;12/01/2016 03:35;0;0;@cgpb I was diagnosed with PTSD after 9/11.;;@cgpb;;6.87E+17;https://twitter.com/Loxodonta_s/status/686632636362665984
ptsdforum;11/01/2016 14:50;0;0;Fustrated-I was diagnosed with ptsd at 15. I don t remember a life without it. I remem URL myptsd.com/c/threads/fust rated.58676/ ;;;;6.86E+17;https://twitter.com/ptsdforum/status/686439940209655808
tx_angel76;11/01/2016 11:03;0;0;I a survivor of rape and domestic violence physical emotional and mental. I was diagnosed with complex ptsd . I am ha e double .............;;;;6.86E+17;https://twitter.com/tx_angel76/status/686382914758688768
debnamcanaries;10/01/2016 23:10;0;0;@JRothenbergTV Thank you for representing PTSD so well. I was recently diagnosed with it and it's great watching characters deal w/it too.;;@JRothenbergTV;;6.86E+17;https://twitter.com/debnamcanaries/status/686203407716102144
sadomasocircuit;08/01/2016 13:44;0;1;@literalshipley i was recently diagnosed with PTSD too. it feels weird to be able to point and have a word for what i've been feeling;;@literalshipley;;6.85E+17;https://twitter.com/sadomasocircuit/status/685336309729112064
whitneypowell23;06/01/2016 19:41;0;0;@WmenwPTSDUnited I was diagnosed with ptsd when I was 16 I am 23 now. It is very hard to feel normal and It is a struggle.;;@WmenwPTSDUnited;;6.85E+17;https://twitter.com/whitneypowell23/status/684701207248678912
Morbid_Complex;06/01/2016 12:50;1;2;@aneonerd @Skin_Yard Yeah. Especially caffeine. But with me its anxiety from PTSD . Diagnosed with it since i was 12. And not the tumblr kind;;@aneonerd @Skin_Yard;;6.85E+17;https://twitter.com/Morbid_Complex/status/684597784905953284
charlotteirene8;05/01/2016 19:19;0;0;@amaditalks I'm going to soon. I know I need a change in meds, especially after I was diagnosed with anxiety and PTSD along with depression.;;@amaditalks;;6.84E+17;https://twitter.com/charlotteirene8/status/684333461721632768
13itch_Face;04/01/2016 12:43;0;0;I was diagnosed with PTSD & in October & many people left my life because of it. I'm slowly learning to cope. I... http:// fb.me/2iyrjytnn;;;;6.84E+17;https://twitter.com/13itch_Face/status/683871337111261184
OmgNoStahp;03/01/2016 12:51;0;0;Fucking lied to myself for 2 years. Told myself I was fine. Fucking diagnosed with PTSD , anxiety, and chronic depression. Fuck that life.;;;;6.84E+17;https://twitter.com/OmgNoStahp/status/683510888977035265
mhn247;01/01/2016 12:34;0;1;Support for Anxiety Depression and PTSD : After leaving the Armed Forces, I was diagnosed with clinical Depress... http:// bit.ly/1mnd8zb;;;;6.83E+17;https://twitter.com/mhn247/status/682781815719903232
cajun032759;01/01/2016 07:25;0;2;@Quoimio @CplSoletrain @RealMarkCole @_HankRearden well I was diagnosed with PTSD about 10 years ago. But have over come it.;;@Quoimio @CplSoletrain @RealMarkCole @_HankRearden;;6.83E+17;https://twitter.com/cajun032759/status/682704075851468801
kaydelko;01/01/2016 06:29;0;2;hi lol remember my thesis on ptsd you were thrilled about? i can't do it anymore because i was diagnosed with ptsd lol happy new year;;;;6.83E+17;https://twitter.com/kaydelko/status/682689972026109952
Dita1960Ls;01/01/2016 06:06;0;0;@DrPhil I was diagnosed with PTSD when I was in counseling and I know my younger siblings all have it;;@DrPhil;;6.83E+17;https://twitter.com/Dita1960Ls/status/682684193260847109
laurabeastly;01/01/2016 02:23;0;1;2015 was the year I was diagnosed with depression, generalized anxiety disorder & PTSD . But it's over now, and I'm still here so that's good;;;;6.83E+17;https://twitter.com/laurabeastly/status/682628047309266945
loudmouthjulia;31/12/2015 23:25;0;1;spent a week in the hospital for something I was diagnosed with , lost an uncle I loved dear, and watched my brother deal with PTSD . But 2/n;;;;6.83E+17;https://twitter.com/loudmouthjulia/status/682583312846712832
paulmesser29;31/12/2015 10:00;0;3;@PTSD _Chat I was diagnosed with Complex PTSD back in 2012 pic.twitter.com/TCAfLylCJT;;@PTSD;;6.82E+17;https://twitter.com/paulmesser29/status/682380901871955968
HellloQueen;31/12/2015 01:53;0;1;I may be a little paranoid, who knows. I was diagnosed with PTSD months afterward, but I'm usually right when I'm worried anyway;;;;6.82E+17;https://twitter.com/HellloQueen/status/682258249551196160
agayghost;28/12/2015 21:26;0;0;@vulcains_ does this mean Ive been visited by aliens? I used to have sleep paralysis so bad when I was first diagnosed with PTSD years ago;;@vulcains_;;6.81E+17;https://twitter.com/agayghost/status/681466202565308416
patricepowll102;28/12/2015 11:53;0;1;' I Was Diagnosed With PTSD After Divorce' URL huffingtonpost.com/2014/01/07/div orce-post-traumatic-_n_4557481.html  via @HuffPostDivorce;;@HuffPostDivorce;;6.81E+17;https://twitter.com/patricepowll102/status/681322017358909440
LGBTDoD;27/12/2015 20:47;0;0;#ptsd #veterans Explaining My Ptsd To My Friends - I was diagnosed with PTSD a few months ago and since then ha... http:// ow.ly/39sCtX;;;#ptsd #veterans;6.81E+17;https://twitter.com/LGBTDoD/status/681094095465492480
ptsdforum;27/12/2015 13:41;1;0;Explaining My Ptsd To My Friends-I was diagnosed with PTSD a fe URL myptsd.com/c/threads/expl aining-my-ptsd-to-my-friends.58329/ ;;;;6.81E+17;https://twitter.com/ptsdforum/status/680986756204892160
duckinator;27/12/2015 07:57;0;1;@SlimeGirlfriend I was just like oh. I've been diagnosed with PTSD because of it. I guess that was *even more* fucked up than I thought.;;@SlimeGirlfriend;;6.81E+17;https://twitter.com/duckinator/status/680900182263906304
jesstutt;24/12/2015 07:39;0;0;I worry as I was diagnosed with PTSD because of IVF. Not everyone can handle 6-8 attempts. :(;;;;6.80E+17;https://twitter.com/jesstutt/status/679808502827737092
D4vvg;23/12/2015 02:51;0;3;I was diagnosed with PTSD yesterday. It has been a long year trying to figure shit out. I hope it'll all be worth it in the end.;;;;6.79E+17;https://twitter.com/D4vvg/status/679373588521062400
MBTT_com;22/12/2015 22:34;0;0;How I was Diagnosed with PTSD URL ptsd-forum.net/post-traumatic -stress-disorder/video-post-traumatic-stress-disorder/how-i-was-diagnosed-with-ptsd/ ;;;;6.79E+17;https://twitter.com/MBTT_com/status/679309135645704192
paulmesser29;20/12/2015 13:04;0;3;I was diagnosed with Complex PTSD in 2012. #ink #mentalhealthawareness #mentalillness #PTSD #ptsdchat #PTSDproblems pic.twitter.com/RmeR28EgP7;;;#ink #mentalhealthawareness #mentalillness #ptsd #ptsdchat #ptsdproblems;6.78E+17;https://twitter.com/paulmesser29/status/678440845985587200
FreqnAndVibin;18/12/2015 08:46;0;1;1. Starting off shitty, I was diagnosed with PTSD and Manic Depression at the age of 13.;;;;6.78E+17;https://twitter.com/FreqnAndVibin/status/677651008906993665
rosiemovedbye;17/12/2015 08:33;0;8;i played tlou shortly after i was diagnosed with ptsd was always zoning out and dissociating just like ellie in that scene;;;;6.77E+17;https://twitter.com/rosiemovedbye/status/677285372158713858
MBTT_com;16/12/2015 06:12;0;0;How I was Diagnosed with PTSD http:// twib.in/l/apR7xn5bznb | https:// twibble.io;;;;6.77E+17;https://twitter.com/MBTT_com/status/676887586518925313
PTSD_org;16/12/2015 05:59;0;0;How I was Diagnosed with PTSD URL post-traumatic-stress-disorder.org/ptsd/how-i-was -diagnosed-with-ptsd/ ;;;;6.77E+17;https://twitter.com/PTSD_org/status/676884312634036224
ASterling;16/12/2015 04:46;0;1;Katharine Kit Kerr - please tell your friends that I am a nutjob for real - I was diagnosed with PTSD in June,... http:// fb.me/7ArVAzoUX;;;;6.77E+17;https://twitter.com/ASterling/status/676865927640559616
RecklessHarding;15/12/2015 20:11;0;0;@UptightVet > the other way if she wanted.- I was diagnosed with PTSD when I got back from my first tour. I just got back from another >;;@UptightVet;;6.77E+17;https://twitter.com/RecklessHarding/status/676736216557969409
rlcassidy;15/12/2015 06:54;0;4;I was just diagnosed with #PTSD following the March 2nd attack. Prayers & good thoughts appreciated. URL camelcitydispatch.com/for-richard-ca ssidy/ ;Winston-Salem, NC;;#ptsd;6.77E+17;https://twitter.com/rlcassidy/status/676535876000849920
katrina798;13/12/2015 13:18;0;1;2. In 2003 I was diagnosed with & beat thyroid cancer, was hospitalized (psych) for depression & ptsd , met my husband, & finished college.;;;;6.76E+17;https://twitter.com/katrina798/status/675907533953851392
AshleySmithYT;12/12/2015 04:33;0;0;@jo3ylamarcs 15) I was diagnosed with OCD, GAD, PTSD , and depression in highschool but haven't experienced it (badly at least) for 2 years;;@jo3ylamarcs;;6.75E+17;https://twitter.com/AshleySmithYT/status/675413173936267264
Shasta_Otter;12/12/2015 02:59;0;1;28) I was recently tested for ADHD, but instead was diagnosed with PTSD . I'm in therapy for that, and getting a scrip for an antidepressant.;;;;6.75E+17;https://twitter.com/Shasta_Otter/status/675389439577743360
Leon2Infinity;11/12/2015 08:05;0;0;Today ive been i was diagnosed with ptsd & insomnia they prescribed me something called rozerem. .. i popped 2 of emm ..bruh;;;;6.75E+17;https://twitter.com/Leon2Infinity/status/675104199672209408
09BRAININJURY;11/12/2015 03:41;0;0;@JacLaurita HI jac how is your son nicholas doing i pray okay i hope I WAS DIAGNOSED WITH BRAIN INJURY and ptsd in 2009 been 6yrs now.;;@JacLaurita;;6.75E+17;https://twitter.com/09BRAININJURY/status/675037576764522496
beatriceca;10/12/2015 12:55;0;4;the fic I wrote /before I was diagnosed with ptsd / about Bucky having ptsd is a great fic. go me.;;;;6.75E+17;https://twitter.com/beatriceca/status/674814581118738432
homuhcidal;10/12/2015 12:13;0;1;fact: i was diagnosed with severe depression and PTSD after being misdiagnosed with ADD for a few years. i do not have ADD.;;;;6.75E+17;https://twitter.com/homuhcidal/status/674804213432655872
MyNameIsAcacia;09/12/2015 15:26;0;0;I was recently diagnosed with : ptsd , severe anxiety disorder, fibromyalgia, endometriosis and not giving a fuck. I still need care tho.;;;;6.74E+17;https://twitter.com/MyNameIsAcacia/status/674490393594056704
StarrLitLove;07/12/2015 13:34;0;0;#Repost from @active_minds  When I was diagnosed with depression, anxiety and PTSD , I was  URL instagram.com/p/--qGImNpcs/;;@active_minds;#repost;6.74E+17;https://twitter.com/StarrLitLove/status/673737254649597952
nerd_proud;07/12/2015 08:13;0;0;Hey all, I'm sorry for the lack of posting. I was recently diagnosed with PTSD and I've been battling a lot of... http:// fb.me/6ZYOyTfAA;;;;6.74E+17;https://twitter.com/nerd_proud/status/673656497310720005
littlepumacub;07/12/2015 05:30;0;0;@MHponderland that wasn't my experience, I was diagnosed with PTSD first and a nonspecific PD 2nd, and my therapist treated it #BPDChat;;@MHponderland;#bpdchat;6.74E+17;https://twitter.com/littlepumacub/status/673615427818291200
kreayshawna;06/12/2015 12:00;0;0;I've been diagnosed with PTSD , severe depression and severe anxiety since I was 12. I didn't think it would get better. but it did.;;;;6.73E+17;https://twitter.com/kreayshawna/status/673351361870716928
scooter27a;05/12/2015 10:00;0;0;@amyjemerson @Morgan_Raimondi @gem1983gemma I was diagnosed with PTSD after I left. It's hard getting your life back but you'll get there.;;@amyjemerson @Morgan_Raimondi @gem1983gemma;;6.73E+17;https://twitter.com/scooter27a/status/672958693118472192
MadisonMontag;05/12/2015 07:32;1;7;I tried killing myself early nov. I was diagnosed with ptsd in the hospital. I never wanted this attention! It's been pure hell for me!;;;;6.73E+17;https://twitter.com/MadisonMontag/status/672921383379279876
adrianaunis;04/12/2015 21:43;0;1;@feminist_tinder Both my assaults happened in my own house, my own room, in my own bed. I was diagnosed with PTSD after.;;@feminist_tinder;;6.73E+17;https://twitter.com/adrianaunis/status/672773182835793920
najieehah;03/12/2015 04:30;0;0;Not recovered yet, of course. But recovering. Been 2 years since i was diagnosed with PTSD ... Gotta make awareness guys. Bismillah;;;;6.72E+17;https://twitter.com/najieehah/status/672150970705379328
nourAbuAlkhair;02/12/2015 09:55;0;1;#TheFlash I was diagnosed with PTSD when I found out that my fiancee watches a teenagers show like this @Ahmedtolah;;@Ahmedtolah;#theflash;6.72E+17;https://twitter.com/nourAbuAlkhair/status/671870289756618752
kingdip90;01/12/2015 14:59;0;0;I was diagnosed with ptsd about 2 years ago and have tried multiple ways to avoid the fear of admittedly rare (ish) symptoms. #PTSD;;;#ptsd;6.72E+17;https://twitter.com/kingdip90/status/671584311045455872
WhispersRedASMR;30/11/2015 15:29;0;1;@SiaAddictUSA ASMR is wonderful isn't it? I was diagnosed with PTSD too, a few years ago. Vids helped me a lot;;@SiaAddictUSA;;6.71E+17;https://twitter.com/WhispersRedASMR/status/671229648701956096
spectresister;30/11/2015 08:39;0;0;lmao and she knows how fucked up i am about sex i was diagnosed with ptsd and shes still pushing this;;;;6.71E+17;https://twitter.com/spectresister/status/671126317119774720
RecklessHarding;30/11/2015 03:44;0;0;> Don't Kai, it's my fault. I shouldn't have snuck up on you. I knew better. After my last tour ended, I was diagnosed with PTSD . For>;;;;6.71E+17;https://twitter.com/RecklessHarding/status/671052048582995968
normreedvs;30/11/2015 00:57;0;0;@gashoeIine I understand completely i quit college last febuary bc i was diagnosed with anxiety, ptsd and depression. Taking time for;;@gashoeIine;;6.71E+17;https://twitter.com/normreedvs/status/671010065705488384
kingxsIayer;29/11/2015 23:15;1;1;I was 14 when I was diagnosed with PTSD and severe depression. I'm now almost 20. So I'll tell you what I'll do. I'll take - @rregulusbIack;;@rregulusbIack;;6.71E+17;https://twitter.com/kingxsIayer/status/670984318236381186
MortuaryReport;29/11/2015 17:44;0;1;since i've left the mortuary, the PTSD i was diagnosed with after my abusive marriage ended has ramped up considerably;;;;6.71E+17;https://twitter.com/MortuaryReport/status/670901139005571073
xxsc0rp1dxx;29/11/2015 11:34;0;1;I was diagnosed with PTSD the other day, but I doubt anyone can do anything to help me, simply because the people are still free;;;;6.71E+17;https://twitter.com/xxsc0rp1dxx/status/670808077386522624
studvan;29/11/2015 09:27;0;2;#MentalHealthPosi when i was first diagnosed with depression, severe social anxiety, and ptsd , i felt like i couldn't explain myself.;;;#mentalhealthposi;6.71E+17;https://twitter.com/studvan/status/670776153028759553
MrGiles2;28/11/2015 05:50;0;0;@lucyparge Of course Lucy, I was diagnosed with PTSD about 8 years ago, and still have bad days.;;@lucyparge;;6.70E+17;https://twitter.com/MrGiles2/status/670358998856675329
EmmaLouiseWebb3;28/11/2015 00:55;0;1;@HordleyJeff @emmerdale epic stuff. Glad the show is covering a story on PTSD . Its not nice. I was diagnosed with it 3 years ago;Portsmouth, England;@HordleyJeff @emmerdale;;6.70E+17;https://twitter.com/EmmaLouiseWebb3/status/670284704575266816
PurpleRoseBlue;27/11/2015 20:40;0;0;I was later diagnosed with PTSD .do I think that retail job 100% caused it, no, but it definitely put it in motion.I never dissociated before;;;;6.70E+17;https://twitter.com/PurpleRoseBlue/status/670220686061883392
Cadenza_33;25/11/2015 13:32;0;0;Today, I was diagnosed with #PTSD . I have a hard road ahead, but at least now I know what I am facing. I will overcome this.;;;#ptsd;6.69E+17;https://twitter.com/Cadenza_33/status/669388142068150273
walkwithmany;21/11/2015 18:38;0;0;I learned by visit with neurologist head injury can mimic such as adhd and ptsd . I was diagnosed with adhd and PTSD .;Sioux Falls, SD;;;6.68E+17;https://twitter.com/walkwithmany/status/668015531031597056
Senjouguu;21/11/2015 18:01;0;0;@SalmonDelicious I'm super fucking sad and lethargic and shit usually I was diagnosed with major depression and ptsd so ayy;;@SalmonDelicious;;6.68E+17;https://twitter.com/Senjouguu/status/668006350874673152
KingMythz;21/11/2015 07:41;0;0;I was diagnosed with PTSD when i was 13 because of all the shit thats happened to me.... does that give you an idea of how fucked my head is;;;;6.68E+17;https://twitter.com/KingMythz/status/667850234614194176
3alia2_;21/11/2015 07:09;21;56;On the bright side, I was diagnosed with both PTSD and depression about 16 months ago and now I'm almost cured with medications. #GetHelp;;;#gethelp;6.68E+17;https://twitter.com/3alia2_/status/667842197207781376
lalajayreckless;20/11/2015 11:52;0;0;Oh man I took Annaliese Keatings class, I was diagnosed with PTSD shorty after.;;;;6.68E+17;https://twitter.com/lalajayreckless/status/667551121146163200
sporkbot;20/11/2015 06:15;0;10;i was just diagnosed with ptsd that i've apparently been coping with for 15 years. seeing this helped a little. https:// twitter.com/UnseenPerfidy/ status/667435210691227648 ;;;;6.67E+17;https://twitter.com/sporkbot/status/667466328718995456
ptsdforum;19/11/2015 08:45;0;0;Recently Diagnosed With Ptsd-Hi all, I was recently diagnosed (thou URL myptsd.com/c/threads/rece ntly-diagnosed-with-ptsd.57553/ ;;;;6.67E+17;https://twitter.com/ptsdforum/status/667141595607777280
Tim_Beshara;18/11/2015 06:53;0;1; I was diagnosed with PTSD later when I raised it with my superiors. I was incensed that I was sent home.;;;;6.67E+17;https://twitter.com/Tim_Beshara/status/666751023986307073
Jess_Aldrich21;18/11/2015 02:45;1;1;T7 I was diagnosed with PTSD 6 years ago. After years of therapy I am recovered.Now finishing my MA for mental health counseling #abcDrBchat;;;#abcdrbchat;6.67E+17;https://twitter.com/Jess_Aldrich21/status/666688753537146881
gabmorales19;17/11/2015 16:48;0;0;@pstokesbooks Yeah, my parents didn't have a great relationship. I was diagnosed with PTSD at age 6 or 7 because of my dad.;;@pstokesbooks;;6.67E+17;https://twitter.com/gabmorales19/status/666538439827849216
ptsdforum;16/11/2015 14:40;0;0;Coping...or Not Coping In My Case-I was diagnosed with PTSD from URL myptsd.com/c/threads/copi ng-or-not-coping-in-my-case.57495/ ;;;;6.66E+17;https://twitter.com/ptsdforum/status/666143736448069633
44thumper;12/11/2015 20:16;0;0;@foxandfriends @FoxNews I was diagnosed with PTSD and related stuff 2 years ago and to date, nothing! Yes they deserve a bonus!;;@foxandfriends @FoxNews;;6.65E+17;https://twitter.com/44thumper/status/664778902632402949
