username;date;retweets;favorites;text;geo;mentions;hashtags;id;permalink
kinoyo246;10/07/2016 04:38;0;0;Please don't say My/ I was diagnosed with depression/ anxiety  it makes it seem like you're owning it, it's part of you when I know it's not;;;;7.52E+17;https://twitter.com/kinoyo246/status/751878154386538496
kioranisha_;10/08/2016 14:29;0;4;today I was diagnosed with depression , anxiety , and ptsd;;;;7.63E+17;https://twitter.com/kioranisha_/status/763260916674727936
Kirstie_Schultz;18/03/2015 03:31;0;1;I was diagnosed with PTSD today on top of my anxiety and depression. I feel relieved to have the label, but also bummed. #chroniclife;;;#chroniclife;5.78E+17;https://twitter.com/Kirstie_Schultz/status/577915274659303424
Kirstie_Schultz;10/01/2015 23:00;0;0;Photo: Yesterday I was playing around with my EMR. I knew I had been diagnosed with general anxiety ... http:// tmblr.co/ZsGDbw1aIyvzs;;;;5.54E+17;https://twitter.com/Kirstie_Schultz/status/553929457476829185
KirstinSeptic;23/12/2015 11:34;0;0;I was medically diagnosed with anxiety today. Have to be on meds for it.;;;;6.80E+17;https://twitter.com/KirstinSeptic/status/679505387691847681
KISSYCUTlE;13/05/2015 06:32;0;0;// i was professionally diagnosed with autism and anxiety and a mood disorder at a young age bc my symptoms were so severe //;;;;5.98E+17;https://twitter.com/KISSYCUTlE/status/598254510696505345
KitManSKC;01/05/2015 01:46;0;18;I was diagnosed with @JimmyConrad separation anxiety;;@JimmyConrad;;5.94E+17;https://twitter.com/KitManSKC/status/593833898749997056
kittcnpaws;01/04/2015 22:29;0;0;Today i was diagnosed with social anxiety and i feel like utter shit.;;;;5.83E+17;https://twitter.com/kittcnpaws/status/583275036745736192
Kitten_Yoyo;04/08/2014 20:27;0;0;@RavenRaspera also gonna get a shitty job because I was diagnosed with anxiety fff;;@RavenRaspera;;4.96E+17;https://twitter.com/Kitten_Yoyo/status/496271277326217216
kitttenqueen;23/03/2016 05:19;3;20;A few months after my anxiety & depression diagnosis, I was diagnosed with PTSD. #MentalHealthAwarenessDay;;;#mentalhealthawarenessday;7.12E+17;https://twitter.com/kitttenqueen/status/712388131752783872
kitttenqueen;23/03/2016 05:18;5;48;I was diagnosed with severe depression & anxiety disorders a few days before my 15th birthday in the psych ward. #MentalHealthAwarenessDay;;;#mentalhealthawarenessday;7.12E+17;https://twitter.com/kitttenqueen/status/712388000965988352
kittyangelface;23/09/2016 00:52;0;0;When I was 18, I was diagnosed with 3 anxiety disorders, and my biggest fear was always death.;;;;7.79E+17;https://twitter.com/kittyangelface/status/779000515304665088
KittyCormack;13/02/2016 22:14;0;0;Got something from the #dwp today that states that I was diagnosed with ocd, manic depression, anxiety  when I was 6. DEFINITELY NOT TRUE.;;;#dwp;6.99E+17;https://twitter.com/KittyCormack/status/698510609583841281
KittyEmm;17/03/2016 17:40;0;0;One year ago today I was diagnosed with severe depression and anxiety , I was referred to a URL instagram.com/p/BDDKiHOLPXo/;;;;7.10E+17;https://twitter.com/KittyEmm/status/710400333961367554
KizzyCatt;22/04/2016 05:24;0;0;@_MidnightPurple I WAS DIAGNOSED WITH AUTISM AND ADHD AT 3 YEARS OLD, DIAGNOSED WITH ANXIETY AT 19 YEARS OLD;;@_MidnightPurple;;7.23E+17;https://twitter.com/KizzyCatt/status/723261110812610561
KlaineBrittana_;11/01/2016 16:34;0;0;Well I was diagnosed with depression and anxiety today. How was everyone else's day?;;;;6.86E+17;https://twitter.com/KlaineBrittana_/status/686466191100002304
KMaximick;28/01/2016 03:27;2;1;I was diagnosed with anxiety in 2011. I live with it daily, but recent circumstances have made it worse physically lately. #BellLetsTalk;;;#bellletstalk;6.92E+17;https://twitter.com/KMaximick/status/692428686130225152
kmyre;06/09/2016 12:51;0;0;I don't think anyone ever expects to be diagnosed with depression and/or anxiety . When I was first diagnosed I... http:// fb.me/5Fc7SCRFA;;;;7.73E+17;https://twitter.com/kmyre/status/773020861850845185
KodyKarls1;24/02/2016 09:28;0;0;@ItsLitRnFam Hell yeah, man, I was diagnosed with severe anxiety , so I wouldn't mind going back to the days of 2010 - 2012.;;@ItsLitRnFam;;7.02E+17;https://twitter.com/KodyKarls1/status/702303982874529796
kokaine_krazy16;31/03/2016 07:36;0;0;Yesterday I was diagnosed with Adult ADHD, Anxiety , and OCD ...;;;;7.15E+17;https://twitter.com/kokaine_krazy16/status/715321834024124417
KoryLee28;22/12/2014 12:42;0;0;'d the video @annaclendening I was diagnosed with manic depression @15 and anxiety issues last yr. I feel ya girl! Much love!!;;@annaclendening @15;;5.47E+17;https://twitter.com/KoryLee28/status/546888364918845440
KPageIsGreat;28/06/2014 01:27;0;0;I was diagnosed with depression, anxiety , and PTSD. Those aren't good things to have.;;;;4.83E+17;https://twitter.com/KPageIsGreat/status/482576059804958720
kpagekirby;02/05/2014 02:32;0;0;May is Mental Health Awareness month. I was diagnosed with bipolar disorder (with a hint of anxiety thrown in for fun) at 35. Ask for help.;;;;4.62E+17;https://twitter.com/kpagekirby/status/461936132645978113
KrauseElle;19/07/2016 10:44;0;0;@OfficialBradlee I know because I was also diagnosed with anxiety , and depression. But we'll get better, and that's all that matters!;;@OfficialBradlee;;7.55E+17;https://twitter.com/KrauseElle/status/755231883059929088
kreayshawna;06/12/2015 12:00;0;0;I've been diagnosed with PTSD, severe depression and severe anxiety since I was 12. I didn't think it would get better. but it did.;;;;6.73E+17;https://twitter.com/kreayshawna/status/673351361870716928
kriemhildsrache;03/04/2016 01:20;0;1;i was diagnosed with general anxiety disorder in fucking PRIMARY SCHOOL because i was so hyper aware that people mocked me and found me odd;;;;7.16E+17;https://twitter.com/kriemhildsrache/status/716314444234665984
kris_shaw25;08/10/2015 02:28;0;0;@harto I was diagnosed with anxiety disorder,some people just assume, they don't get how hard it is to fight with your own mind constantly.;;@harto;;6.52E+17;https://twitter.com/kris_shaw25/status/651826519279542272
Kris_Summ;12/06/2016 12:07;0;0;Earlier this year I was diagnosed with depression and anxiety . This means that every day I URL instagram.com/p/BGiff-ZsUxs/;;;;7.42E+17;https://twitter.com/Kris_Summ/status/741844462586892289
krisiness_;17/06/2016 10:11;0;0;June 20th marks 2 years since I was diagnosed with #bpd #depression and #anxiety woooooo its been a ride #mentalhealth;;;#bpd #depression #anxiety #mentalhealth;7.44E+17;https://twitter.com/krisiness_/status/743627210293030912
kristinakolbert;06/10/2016 07:40;1;3;The year before I lost my health insurance, I was diagnosed with depression and anxiety . I had help for a good year. #tytlive;;;#tytlive;7.84E+17;https://twitter.com/kristinakolbert/status/783814049221836800
kscSharpe;16/10/2014 05:59;0;0;Mother of 3: I was trying to be the perfect mom, then I woke up in hospital diagnosed with anxiety and major depression #cbcnl;;;#cbcnl;5.23E+17;https://twitter.com/kscSharpe/status/522507175592493057
KsJourney_;15/09/2016 07:21;0;1;So yesterday was a big day for me. I was officially diagnosed with an eating disorder. #EatingDisorders #mentalhealth #anxiety #depression;;;#eatingdisorders #mentalhealth #anxiety #depression;7.76E+17;https://twitter.com/KsJourney_/status/776199340683649024
kun0ba;30/10/2015 04:42;0;1;@baesilias someone tried to tell me, someone who's diagnosed with anxiety and depression since I was a teen, what it's like to have anxiety;;@baesilias;;6.60E+17;https://twitter.com/kun0ba/status/659832826909564930
KunoichiJen;09/10/2014 01:46;0;0;@BIGGMIKE904 Recently diagnosed with Bi Polar 1 which i was suffering from for 10 years diagnosed. Anxiety , and Trichotillomania;;@BIGGMIKE904;;5.20E+17;https://twitter.com/KunoichiJen/status/519906724992413696
kvmatora;01/02/2016 21:39;0;0;I got diagnosed with severe social anxiety at 17 and i was just that sounds fake but okay... while being scared of the phone;;;;6.94E+17;https://twitter.com/kvmatora/status/694153120046288896
KyeTheGoddess;16/02/2015 13:08;0;3;I've been diagnosed with depression and anxiety since I was 8, my brother has severe autism. Don't joke about mental illness w/ me. Thanks.;;;;5.67E+17;https://twitter.com/KyeTheGoddess/status/567188657975873537
kyledavISNT;01/11/2014 07:42;0;3;I WAS DIAGNOSED WITH ANXIETY DURING THE STROBE LIGHT ROOM OF BARRETTS HAUNTED MANSION;;;;5.28E+17;https://twitter.com/kyledavISNT/status/528331265284780032
KyleeRLogan;29/04/2016 08:30;0;0;When I was diagnosed with cancer I developed depression & anxiety . You can't go through so much and expect your brain to feel well. -doc;;;;7.26E+17;https://twitter.com/KyleeRLogan/status/725844657519890432
labakyriqor;24/04/2015 18:52;0;0;I was finally diagnosed with Anxiety and depression at 11 years of age.;;;;5.92E+17;https://twitter.com/labakyriqor/status/591555320205414400
labrys75;14/08/2014 01:19;0;2;Let's stamp out the stigma! I was diagnosed with Anxiety , Depression, and ADD 3 years ago. @KarenDernie @jenniferbeals @_melsroom;;@KarenDernie @jenniferbeals @_melsroom;;5.00E+17;https://twitter.com/labrys75/status/499606263484149760
Lady_Amalthea33;04/08/2014 20:24;0;0;@NitroLukeDX I was diagnosed with anxiety disorder a couple years ago. It's a hard thing to go through. I have had sleep paralysis.;;@NitroLukeDX;;4.96E+17;https://twitter.com/Lady_Amalthea33/status/496270365237469184
LadyNorthern;06/09/2014 05:52;0;0;So, today I was diagnosed with social anxiety disorder.;;;;5.08E+17;https://twitter.com/LadyNorthern/status/508009897129426944
ladystarship;17/08/2016 11:04;0;2;"in regards to my doctors appointment last week; i was re-diagnosed with my ADHD, and they threw in some high/severe anxiety too. oh boy";;;;7.66E+17;https://twitter.com/ladystarship/status/765746195218194432
ladyyghostt;15/08/2014 00:22;0;1;Seriously, though. I was diagnosed with depression and anxiety in the 8th grade. And God forbid I ever speak out about it.;;;;5.00E+17;https://twitter.com/ladyyghostt/status/499954218242174976
lalabarnett;03/10/2014 22:42;0;0;patient social listening:  i was diagnosed with anxiety & hypochondria, but i really do think this time there's more to it #bestYet #golden;;;#bestyet #golden;5.18E+17;https://twitter.com/lalabarnett/status/518048370280394753
LaLaLivvyxo;11/04/2015 19:14;0;1;I was diagnosed with depression when I was 18, the anxiety developed from personal shit that happened and I was diagnosed with Asperger's-;;;;5.87E+17;https://twitter.com/LaLaLivvyxo/status/586849756204429314
lambeasts;11/05/2016 09:32;0;1;i was diagnosed with PTSD BPD major depressive disorder anxiety disorder and there is a chance of bipolar disorder pic.twitter.com/eqHCL9VDGI;;;;7.30E+17;https://twitter.com/lambeasts/status/730208910481756160
lanadelsmith_;14/07/2015 04:35;0;2;Confession: I was diagnosed with Generalized Anxiety Disorder (GAD) a few months ago;;;;6.21E+17;https://twitter.com/lanadelsmith_/status/620693027263258624
lancethestarboy;28/10/2016 04:10;0;1;@lancethestarboy 13. i cant think of anything else lmao uh i was diagnosed with an anxiety disorder when i was 19;;@lancethestarboy;;7.92E+17;https://twitter.com/lancethestarboy/status/791733740787466240
laneferris;05/05/2015 02:25;0;0;I was diagnosed with anxiety , depression, and ADD just over a year ago. With lots of support and talking... I've won https:// twitter.com/Bell_LetsTalk/ status/595287416249917441 ;;;;5.95E+17;https://twitter.com/laneferris/status/595293252225409024
laneybaby;11/03/2016 06:36;0;0;Yesterday I was diagnosed with having social anxiety and inattentive-type ADHD on top having major depression #mentalhealthawareness;;;#mentalhealthawareness;7.08E+17;https://twitter.com/laneybaby/status/708058925464227842
larryarehome;29/05/2014 18:33;0;9;I was diagnosed with serious anxiety and something else and today I am going to a mall to try and handle my anxiety I am petrified;;;;4.72E+17;https://twitter.com/larryarehome/status/471962649862078464
lashtonkiss;05/03/2016 23:32;0;0;@murderizingcal I was diagnosed with anxiety in kindergarten and now I got this great;;@murderizingcal;;7.06E+17;https://twitter.com/lashtonkiss/status/706140334753976320
lashtonsunrise;08/10/2014 15:51;0;0;Today I was diagnosed with major depression and social anxiety;;;;5.20E+17;https://twitter.com/lashtonsunrise/status/519757042131562498
LaSouvarine;10/08/2016 02:20;0;0;#mentalhealthcaresopoor i was diagnosed with chronic depression & anxiety at 13. 10 yrs later i mention i am an abuse survivor, get PD added;;;#mentalhealthcaresopoor;7.63E+17;https://twitter.com/LaSouvarine/status/763077566240550912
latentCelestial;18/02/2015 12:46;0;1;@kremisius [tw: disorders] I was introduced to it in 2010 I think? And I had anxiety and depression and have been diagnosed with bipolar,-;;@kremisius;;5.68E+17;https://twitter.com/latentCelestial/status/567907990453510144
LauraBailo;04/05/2016 19:32;0;1;@MeganErickson_ Thank you for writing this, Megan! I was diagnosed with anxiety just a while ago, and I finally feel like I can write again.;;@MeganErickson_;;7.28E+17;https://twitter.com/LauraBailo/status/727823149480480768
laurabeastly;01/01/2016 02:23;0;1;2015 was the year I was diagnosed with depression, generalized anxiety disorder & PTSD. But it's over now, and I'm still here so that's good;;;;6.83E+17;https://twitter.com/laurabeastly/status/682628047309266945
LauraHolds28;12/02/2016 22:08;0;0;@jennymarston_xo @TheGirlGangHQ So today I was diagnosed with anxiety & depression- can't explain how much this means to me right now Jenny!;;@jennymarston_xo @TheGirlGangHQ;;6.98E+17;https://twitter.com/LauraHolds28/status/698146655829409792
LauraORourke;28/01/2015 22:23;1;6;#BellLetsTalk last year I was diagnosed with depression and anxiety .;;;#bellletstalk;5.60E+17;https://twitter.com/LauraORourke/status/560443090146983936
Lauren_murphss;27/04/2016 20:17;0;1;I was diagnosed with anxiety at 17 and couldn't even leave the house and once again was given a website to look at.. #IAmAReason;;;#iamareason;7.25E+17;https://twitter.com/Lauren_murphss/status/725297693988368385
laurenbrocious;04/10/2016 11:51;0;1;@laurenbrocious my parents took me to the hospital and I ended up seeking help. I was diagnosed with clinical depression and anxiety .;;@laurenbrocious;;7.83E+17;https://twitter.com/laurenbrocious/status/783152424399675392
LaurenHope84;18/05/2016 22:26;0;0;Alicia Knight is an #overcomerofanxiety It is tough and difficult to manage. I was diagnosed with anxiety ... http:// fb.me/15q5fSajG;;;#overcomerofanxiety;7.33E+17;https://twitter.com/LaurenHope84/status/732940493324058624
laurenkam420;30/06/2015 12:38;0;0;@Rene_gadeCowboy I was diagnosed with ptsd after a bad car accident. It is the worst. The anxiety is extremely debilitating;;@Rene_gadeCowboy;;6.16E+17;https://twitter.com/laurenkam420/status/615741205603692544
laurenmusedavis;29/08/2015 10:21;0;0;@aramfloodmusic I was diagnosed with chronic anxiety a few years ago I really think I can help, love;;@aramfloodmusic;;6.37E+17;https://twitter.com/laurenmusedavis/status/637450074356772864
LaurenSoul;28/01/2015 21:37;0;0;I've been diagnosed with depression and anxiety since I was a kid. Every day is a struggle. Don't shy away from the issues. #BellLetsTalk;;;#bellletstalk;5.60E+17;https://twitter.com/LaurenSoul/status/560431585410183168
LaurenWaksman;17/12/2015 13:02;0;2;1. I was diagnosed with binge eating disorder, anxiety and depression when I was 18;;;;6.77E+17;https://twitter.com/LaurenWaksman/status/677353181618282497
LaurenzSide;21/07/2014 18:47;0;3;@Vengelfe I feel you Annie! <3 I was diagnosed with Generalized Anxiety Disorder a few years ago. Still working out ways to manage it!;;@Vengelfe;;4.91E+17;https://twitter.com/LaurenzSide/status/491172666251153408
laurerss_;05/11/2016 04:38;0;0;@NevSchulman 20 years old when I was diagnosed with Anxiety , Depression, and chronic panic attacks.... put my entire life on hold.;;@NevSchulman;;7.95E+17;https://twitter.com/laurerss_/status/794640065867710464
LAWelch21;05/02/2015 18:36;0;0;@itvthismorning 2nd feb I was diagnosed with generalised anxiety , unstable personality and dysthymia. Didn't know types of depression exist.;Brighouse, England;@itvthismorning;;5.63E+17;https://twitter.com/LAWelch21/status/563284906781208576
LBrainard0594;01/01/2015 07:17;0;0;So here's my sappy post about 2014. This time last year I was diagnosed with generalized anxiety  http:// instagram.com/p/xSgr28Eqkn/;;;;5.50E+17;https://twitter.com/LBrainard0594/status/550430520304095232
LCC_Counselling;12/07/2016 21:50;0;0;When I was diagnosed with generalised #anxiety , I needed the people around me http:// ow.ly/u3413029Sll pic.twitter.com/1R109GgdE5;;;#anxiety;7.53E+17;https://twitter.com/LCC_Counselling/status/752862630390407168
LCC_Counselling;15/04/2016 19:35;0;0;Its been over four years now since I was first diagnosed with anxiety and depression http:// ow.ly/4mIYLF via @TimetoChange;;@TimetoChange;;7.21E+17;https://twitter.com/LCC_Counselling/status/720938489425108992
LCC_Counselling;05/04/2016 18:05;0;1; I was diagnosed with #depression in 2009 and anxiety soon followed http:// ow.ly/10iM4b via @TimetoChange pic.twitter.com/CiTCcLZ5AO;;@TimetoChange;#depression;7.17E+17;https://twitter.com/LCC_Counselling/status/717291970440404993
lDKSARA;20/02/2015 11:41;1;1;I was diagnosed with depression, anxiety , and a panic disorder last year and I just want to get better thanks;San Diego, CA;;;5.69E+17;https://twitter.com/lDKSARA/status/568616481501491202
leandra_thal;04/10/2015 13:16;0;4;A year ago today, I was diagnosed with severe separation anxiety .it's been fun learning how to help myself when everyone else gives up on me;;;;6.51E+17;https://twitter.com/leandra_thal/status/650539931450802176
Leannagrxce;10/11/2016 13:37;1;2;Today I was diagnosed with anxiety and I've been put on medication and I honestly don't know how I feel;;;;7.97E+17;https://twitter.com/Leannagrxce/status/796587491708911616
leechejamyum;17/10/2015 14:43;0;0;& ppl be like: but you probably have depression, too! and I'm like nah son I was diagnosed with massive amount of anxiety , nothing else;;;;6.55E+17;https://twitter.com/leechejamyum/status/655272867999961088
Leeeese77;18/05/2015 06:36;0;1;Monday I had a panic attack. Tuesday I was diagnosed with anxiety . Wednesday, Thursday, Friday I felt shit with side effects of meds.;Mossley, England;;;6.00E+17;https://twitter.com/Leeeese77/status/600067497086349312
LeelyofdValley;10/09/2016 20:40;0;0;@HudsonLeick exactly what I need. I was diagnosed with anxiety disorder. Yoga was recommended. Thank you. From Philippines with LOVE!;;@HudsonLeick;;7.75E+17;https://twitter.com/LeelyofdValley/status/774588382810734594
Leigh_zard;10/03/2016 07:07;0;0;@emilywrotethis I told them I was diagnosed with depression and anxiety (which I am). I hope I'm not a match!;;@emilywrotethis;;7.08E+17;https://twitter.com/Leigh_zard/status/707704433564585984
LekBlog;01/11/2016 07:48;1;31;I was diagnosed with depression and anxiety a little over a year ago now. I don't deal with it URL instagram.com/p/BMPw3vygOn6/;;;;7.93E+17;https://twitter.com/LekBlog/status/793238281316134914
lemmyrose;06/10/2016 00:38;0;3;When I was diagnosed with PTSD and Anxiety like 5 years ago, I thought that meant I'd have a shitty life but I'm actually pretty happy now.;;;;7.84E+17;https://twitter.com/lemmyrose/status/783708057150758912
Lepra_HinA;31/01/2015 20:55;1;0;After being diagnosed with #leprosy , I was living in fear and anxiety . Hear Jayashree's story http:// bit.ly/1Bz5D7S #WorldLeprosyDay;;;#leprosy #worldleprosyday;5.62E+17;https://twitter.com/Lepra_HinA/status/561507958215827456
lesbianaria;01/11/2016 21:23;0;3;Anyway I was diagnosed with generalized anxiety disorder and now everything makes sense;;;;7.93E+17;https://twitter.com/lesbianaria/status/793443457142513664
leslielynnfaye;28/01/2016 11:55;0;0;I have been dealing with depression since I was 18, and anxiety since I was 21, and diagnosed with severe ptsd a few months ago #LetsTalk;;;#letstalk;6.93E+17;https://twitter.com/leslielynnfaye/status/692556503107178500
lesmiserxbles;31/07/2016 22:03;0;0;@ABHdipbrows OKAY SO LAST YEar I was diagnosed with clinical depression and major anxiety and like at the time I had just moved+;;@ABHdipbrows;;7.60E+17;https://twitter.com/lesmiserxbles/status/759751355540135936
lessmooch;12/04/2015 12:05;0;0;When I was diagnosed with anxiety and mixed depression 2 months ago.;San Antonio, TX;;;5.87E+17;https://twitter.com/lessmooch/status/587104331989528576
letbeasley;01/10/2016 07:02;0;1;@whittynovels post college I was diagnosed with social anxiety disorder. I admire your early awareness .;;@whittynovels;;7.82E+17;https://twitter.com/letbeasley/status/781992744331857921
letossia;17/03/2016 06:32;0;0;Luckily, I was diagnosed with panic disorder, anxiety , and depression in my early teens LUCKILY;Recife, Brazil;;;7.10E+17;https://twitter.com/letossia/status/710232412312215552
lex_silverrr;09/11/2016 14:20;0;0;NOT EVEN WHEN I WAS DIAGNOSED WITH CANCER HAVE I EVER FELT SO MUCH ANXIETY & SADNESS;;;;7.96E+17;https://twitter.com/lex_silverrr/status/796235952943284224
lexi_mae_leach;01/09/2016 03:58;0;2;There is too much going on in my life to be away from home but does that matter? Nope. Its not like I was just diagnosed with anxiety either;Godley, IL;;;7.71E+17;https://twitter.com/lexi_mae_leach/status/771074584883912704
LexiMoncrieff17;23/03/2016 14:18;0;4;So when I went to the doctors today, I was diagnosed with severe anxiety , HOW SHOCKING;Bellingham, WA;;;7.13E+17;https://twitter.com/LexiMoncrieff17/status/712523951818276865
lfarrell1025;30/08/2016 08:33;0;2;I never even knew what anxiety was or what not until I was diagnosed with it;North Tonawanda, NY;;;7.70E+17;https://twitter.com/lfarrell1025/status/770419170915868676
lgbtharry;15/04/2015 02:02;0;0;- i was diagnosed with depression and social anxiety at 12 lmao theres something i bet ye didnt expect;;;;5.88E+17;https://twitter.com/lgbtharry/status/588039746678558720
Lia_HMQ;13/08/2014 19:04;0;0;And that I was doing well and didn't need meds A week before being diagnosed with severe depression and anxiety disorders.;;;;5.00E+17;https://twitter.com/Lia_HMQ/status/499511926389747712
LiamRMcGuire;27/07/2016 10:01;2;2;Two months ago I was diagnosed with Obsessive Compulsive Disorder. It explained a lot. Anxiety , worries and intrusive thoughts sunk me.;;;;7.58E+17;https://twitter.com/LiamRMcGuire/status/758120159072645120
LiamsDirtyDiva;09/02/2015 10:53;1;8;Hence one of the reasons why I was diagnosed with Anxiety and think negative of myself sometimes! I'm stronger than I was but pulled thru;;;;5.65E+17;https://twitter.com/LiamsDirtyDiva/status/564617987110342656
Liamsimlife;06/07/2015 12:15;0;0;@NiallSimsLifee @GemmaSimsLife good. Finally told everyone I was diagnosed with anxiety while Z was in the hospital;;@NiallSimsLifee @GemmaSimsLife;;6.18E+17;https://twitter.com/Liamsimlife/status/617909733610127360
lianne_kendra;28/01/2016 12:39;0;14;Ive had anxiety and panic attacks since I was 15&am diagnosed with BPD. #letstalkaboutit #EndTheStigma #BellLetsTalk;;;#letstalkaboutit #endthestigma #bellletstalk;6.93E+17;https://twitter.com/lianne_kendra/status/692567665412542464
LifeAsAZebra;23/05/2016 05:26;0;0;Zoann Murphy 1. I was diagnosed with Cushing's Syndrome, Asthma, Depression, Anxiety , Fibromyalgia,... http:// fb.me/66DH1YUQ8;;;;7.34E+17;https://twitter.com/LifeAsAZebra/status/734495707315474433
lifesoverated6;08/09/2015 08:19;0;0;And that was when I was diagnosed with anxiety and depression. I was 14 years old when all this was happening and couldn't handle it;;;;6.41E+17;https://twitter.com/lifesoverated6/status/641043054426726400
Lift_andLove;10/06/2015 01:41;0;0;@NutritionMax I'm just curious bc I was diagnosed with depression & anxiety 14 years ago and it's horrible to live with. Always been on meds;;@NutritionMax;;6.08E+17;https://twitter.com/Lift_andLove/status/608327972295217154
Lift_andLove;19/04/2015 03:02;0;17;In 2001 I was diagnosed with depression, anxiety & bipolar disorder. If I want to use it to describe myself, I have that right. So bye girl.;;;;5.90E+17;https://twitter.com/Lift_andLove/status/589504345328189440
lilbear_12345;26/05/2015 10:06;0;0;Well I was diagnosed with anxiety;;;;6.03E+17;https://twitter.com/lilbear_12345/status/603019358353297408
LilBiersackBug;06/01/2016 04:52;0;3;@drtempledragon @leoniedelt Having been diagnosed with anxiety I'm told everything is that! It's silly! I was told my autism was anxiety;;@drtempledragon @leoniedelt;;6.84E+17;https://twitter.com/LilBiersackBug/status/684477638749106176
lilbreck;30/09/2016 13:13;0;2;@katefulleur @sethkvtes When I was young my mom would get frustrated with me. But, when I was older and diagnosed with anxiety disorder...;;@katefulleur @sethkvtes;;7.82E+17;https://twitter.com/lilbreck/status/781723639821508609
LilFootTat;20/09/2016 03:15;0;1;I didn't even have an anxiety disorder until I was diagnosed with one https:// twitter.com/sluttyjoshlerr /status/777763734550740994 ;Thousand Oaks, CA;;;7.78E+17;https://twitter.com/LilFootTat/status/777949149920501764
lilfuriosa;29/01/2015 02:37;4;4;I was diagnosed with depression and generalized anxiety disorder. I am no longer ashamed of this and don't blame myself. #BellLetsTalk;;;#bellletstalk;5.61E+17;https://twitter.com/lilfuriosa/status/560506957220425729
LilHerb_Kent;13/12/2015 08:58;0;0;Also I was diagnosed with anxiety and depression Thursday. Im like wh-what?;;;;6.76E+17;https://twitter.com/LilHerb_Kent/status/675842094880022529
LilleeHartline;02/07/2014 02:48;0;0;So I was diagnosed with depression and anxiety disorders today......hey at least I did something today! That's an accomplishment right??;Warr Acres, OK;;;4.84E+17;https://twitter.com/LilleeHartline/status/484045787584684032
