username;date;retweets;favorites;text;geo;mentions;hashtags;id;permalink
NKFinney;19/10/2013 21:15;0;0;@Doctrine_Man @timmathews @ElSnarkistani I was diagnosed with incontinence after my first deployment - it's kind of like PTSD -lite...;;@Doctrine_Man @timmathews @ElSnarkistani;;3.92E+17;https://twitter.com/NKFinney/status/391553292389453825
kcdates;18/10/2013 00:59;0;0;Seeks understanding (Olathe) 25yr - I'm recently out of the Army after being deployed. I was diagnosed with PTSD .... http:// ow.ly/2AOxro;;;;3.91E+17;https://twitter.com/kcdates/status/390884810669187072
WarriorsLanding;17/10/2013 03:41;0;0;I wanted to share some things that have been helping me heal lately. I was diagnosed with severe complex PTSD and... http:// fb.me/HZeiVP1x;;;;3.91E+17;https://twitter.com/WarriorsLanding/status/390563271260241921
Matt_Edwar;16/10/2013 05:28;0;0;@caseymikeska @emjehovics yea and I was diagnosed with PTSD and acute onset hearing loss;;@caseymikeska @emjehovics;;3.90E+17;https://twitter.com/Matt_Edwar/status/390227724351971328
MilitarywPTSD;14/10/2013 15:17;0;0;Chad Even more lost than ever before. I was diagnosed with severe PTSD about 2 years ago related to combat and a... http:// fb.me/2I4oydfpS;;;;3.90E+17;https://twitter.com/MilitarywPTSD/status/389651180215095296
THEYLOVEHER;13/10/2013 23:06;0;0;I was diagnosed with PTSD a few years ago & I wonder if that's what has been affecting me being that I never followed through with treatment;;;;3.89E+17;https://twitter.com/THEYLOVEHER/status/389406871943393280
nataliaxquerida;11/10/2013 13:56;0;0;"@_jasmincita I was diagnosed with PTSD ; I have the birthgiver to thank for that.";;@_jasmincita;;3.89E+17;https://twitter.com/nataliaxquerida/status/388543656979742720
MaxineSpeechley;10/10/2013 21:23;1;1;@MotherAndBaby I was diagnosed with pnd & ptsd when my twins were 13 month old, only got counselling quickly because dr pushed as am a nurse;;@MotherAndBaby;;3.88E+17;https://twitter.com/MaxineSpeechley/status/388293744812126208
trixiedarko;10/10/2013 15:54;0;2;hi world i was diagnosed with psychotic depression, anxiety disorder & OCD when i was 15. i also have PTSD & PCOS & other problems yay life;;;;3.88E+17;https://twitter.com/trixiedarko/status/388210857944956928
NewLeafCornwall;09/10/2013 23:26;0;0;Spectrum Therapy Changes your life 2007 after the military I was diagnosed with PTSD and awarded a war Pension.... http:// fb.me/3cgIxH7gl;;;;3.88E+17;https://twitter.com/NewLeafCornwall/status/387962352475598848
kdawnpatterson;09/10/2013 13:35;0;0;@PauleyP I can't watch horror movies either. I was diagnosed with PTSD 3 yrs ago, after 30+ yrs of spousal abuse. It's not fun is it.;;@PauleyP;;3.88E+17;https://twitter.com/kdawnpatterson/status/387813513470967809
_shanaynay1;09/10/2013 03:28;0;0;A lot of people don't know this but I was actually diagnosed with ptsd .;;;;3.88E+17;https://twitter.com/_shanaynay1/status/387660856697184256
WarriorsLanding;08/10/2013 22:12;0;0;Hello I was diagnosed with PTSD about 5 years ago. I went to the doctor because I was having panic attacks and... http:// fb.me/2FBrkzQmH;;;;3.88E+17;https://twitter.com/WarriorsLanding/status/387581253563973632
BlitzRunner27;08/10/2013 16:08;0;0;@tvandlust I was diagnosed with clinical depression and PTSD four years ago, although I've had both for a decade longer...;;@tvandlust;;3.87E+17;https://twitter.com/BlitzRunner27/status/387489637016428544
JennGriff_WTR;07/10/2013 23:15;0;1;I am not a WARRIOR like you ==> @AVetwithPTSD but I was diagnosed with #PTSD about 5 years ago... still struggle sometimes, but I will not;;@AVetwithPTSD;#ptsd;3.87E+17;https://twitter.com/JennGriff_WTR/status/387234787141775360
A_J_Reid;04/10/2013 20:43;0;0;@BBCRadio2 At my (then) girlfriend's parents' house when I was 19. I was diagnosed with PTSD , left uni, nearly went to jail. Ruined my life;;@BBCRadio2;;3.86E+17;https://twitter.com/A_J_Reid/status/386109442304905217
lonesomehue;04/10/2013 08:56;0;0;I was diagnosed with PTSD;;;;3.86E+17;https://twitter.com/lonesomehue/status/385931432763195392
madameHdivision;30/09/2013 16:00;0;0;@Edzones I was firstly diagnosed with depression and anxiety. On further examination, it become apparent that its more likely PTSD .;;@Edzones;;3.85E+17;https://twitter.com/madameHdivision/status/384588626429874176
ask_experts;29/09/2013 19:42;0;0;Topic: I was diagnosed with PTSD a long time ago. Any experience with this or what it means? I am completely... http:// fb.me/2AlUjJeWR;;;;3.84E+17;https://twitter.com/ask_experts/status/384281983645253632
ptsdforum;28/09/2013 04:47;0;0;And So I Find Myself Here: Hello. I am a rape survivor. I was diagnosed with PTSD years ago by a university co... http:// bit.ly/160CzuN;;;;3.84E+17;https://twitter.com/ptsdforum/status/383694314779340800
HAlanScott;27/09/2013 04:39;0;2;I go to a shrink because I was diagnosed with PTSD after chemo. And because I'm a delicate flower. #chemocation;;;#chemocation;3.83E+17;https://twitter.com/HAlanScott/status/383330002105671680
henson91408;26/09/2013 10:15;0;1;@EllistonJasmine i was diagnosed with PTSD after that, but i really think im over it. i get a little nervous sometimes still but its allgood;;@EllistonJasmine;;3.83E+17;https://twitter.com/henson91408/status/383052288614354944
zoIdyckmoved;26/09/2013 03:10;0;0;naturally I have anxiety and I was also diagnosed with OD, ADHD (bullshit illness), and PTSD but that's it I think hm;;;;3.83E+17;https://twitter.com/zoIdyckmoved/status/382945169521541120
WarriorsLanding;25/09/2013 08:32;0;0;Hi, I was attacked by a large dog almost two years ago. I did not know right away but was diagnosed with PTSD 9... http:// fb.me/2qpSe9pEl;;;;3.83E+17;https://twitter.com/WarriorsLanding/status/382663772382703616
angreebindii;23/09/2013 23:22;0;0;@stfumisogynists It sort of made sense to me when I was diagnosed with PTSD but the stigma I go through is a harrowing experience. People;;@stfumisogynists;;3.82E+17;https://twitter.com/angreebindii/status/382163091128975360
CorrineSays;23/09/2013 10:36;0;0;@dandylion61 same here, why I was diagnosed with ptsd .;;@dandylion61;;3.82E+17;https://twitter.com/CorrineSays/status/381970331121905664
ptsdforum;23/09/2013 07:01;0;0;Requesting Advice From Supporters From A Fiancee With Ptsd : I was diagnosed with PTSD six years ago, although ... http:// bit.ly/1f8EjYK;;;;3.82E+17;https://twitter.com/ptsdforum/status/381916301523820544
_LovelyyLyseeXo;22/09/2013 12:37;0;0;Then I Got Diagnosed With PTSD & BiPolar When I Was 16 , & Instead Of Taking 15 Pills A Day , I've Been Able To Cope With Weed .;;;;3.82E+17;https://twitter.com/_LovelyyLyseeXo/status/381638284234874881
HeatherGothica;21/09/2013 02:56;0;0;My cold is slowly disappearing but had flashbacks today of stuff that happened. I was recently diagnosed with PTSD .;;;;3.81E+17;https://twitter.com/HeatherGothica/status/381129649218019328
ptsdforum;20/09/2013 00:07;0;0;Lost: I am a 34 year old male. I have a a wife and two kids. I was diagnosed with Bipolar II and recently PTSD ... http:// bit.ly/14mPsxS;;;;3.81E+17;https://twitter.com/ptsdforum/status/380724925775872000
ptsdforum;19/09/2013 18:56;0;0;Change In Ptsd Or Misdiagnosed?: I was diagnosed with PTSD in my late teens, early 20s. I am not saying that ... http:// bit.ly/16pD0v7;;;;3.81E+17;https://twitter.com/ptsdforum/status/380646578974756864
Frostbite___;18/09/2013 22:35;0;0;I was diagnosed with depression and ptsd after my rape. It took a while to accept my mental illnesses and to accept treatment.;;;;3.80E+17;https://twitter.com/Frostbite___/status/380339410367447040
Ty_Damone;17/09/2013 22:50;0;0;@parrish_ciara the ptsd was something that came up and I was diagnosed with at my retirement evaluation when they asked about my life.;;@parrish_ciara;;3.80E+17;https://twitter.com/Ty_Damone/status/379980706991988736
JennNiff;16/09/2013 19:40;1;0;@notwaving > have a career, three degrees and was going on for the fourth when I was diagnosed with severe PTSD . One of the symptoms of >;;@notwaving;;3.80E+17;https://twitter.com/JennNiff/status/379570453196857344
ptsdforum;15/09/2013 01:58;0;0;Giving It A Try: Hi i'm Sara. I was diagnosed with PTSD a few months ago. My therapist thought it would be a g... http:// bit.ly/1gfkolS;;;;3.79E+17;https://twitter.com/ptsdforum/status/378940868381515777
NewLeafCornwall;13/09/2013 18:20;0;0;Spectrum Therapy Simply the best Treatment for PTSD in the UK  I was diagnosed with post-traumatic stress... http:// fb.me/TRzYsqCR;;;;3.78E+17;https://twitter.com/NewLeafCornwall/status/378463081422012416
SamPankuch_63;13/09/2013 11:05;0;0;Well I was diagnosed with PTSD at the doctors office today so I will be seeing a psychiatrist soon.;Seville, OH;;;3.78E+17;https://twitter.com/SamPankuch_63/status/378353745907941376
jjsteeves;11/09/2013 21:22;0;0;@Nicest_Girl_Evr I was diagnosed with PTSD this summer. HOORAY.;;@Nicest_Girl_Evr;;3.78E+17;https://twitter.com/jjsteeves/status/377784109025603584
ptsdforum;05/09/2013 23:46;0;0;Hair Loss?: Hi, I was diagnosed with PTSD 8 months ago, and the last few months I've been losing much more hai... http:// bit.ly/1dUonbU;;;;3.76E+17;https://twitter.com/ptsdforum/status/375646071881342976
COVVHA;04/09/2013 23:02;0;0;I was diagnosed with ptsd at 5 years old and I still have trouble sometimes flashbacks get the best of me and I... http:// fb.me/311py0InT;;;;3.75E+17;https://twitter.com/COVVHA/status/375272667546660864
COVVHA;04/09/2013 22:46;0;0;I was diagnosed with PTSD last year and I am still in the process of learning about symptoms and treatments as... http:// fb.me/2lDEfLSQj;;;;3.75E+17;https://twitter.com/COVVHA/status/375268560446451712
MilSOfitspo;03/09/2013 00:26;0;0;@BrittneyHassell that's insane! Glad you're healthy. Well ya it helped me I was diagnosed with addiction/ PTSD /anxiety/depression....;;@BrittneyHassell;;3.75E+17;https://twitter.com/MilSOfitspo/status/374568940028305408
PDiGennaro;31/08/2013 17:04;0;0;So..earlier today, I was diagnosed with ptsd . Not sure how or what to think. I had a feeling that that was it. But now it's time to heal;;;;3.74E+17;https://twitter.com/PDiGennaro/status/373733073499602945
ptsdforum;31/08/2013 15:08;0;0;How To Show You Care When You Either Feel Nothing Or Feel Anxiety Only?: I was diagnosed with PTSD 12 years ag... http:// bit.ly/1dAuVfG;;;;3.74E+17;https://twitter.com/ptsdforum/status/373703735815331840
ptsdforum;30/08/2013 15:02;0;0;Hearing Voices: I was diagnosed with PTSD over a year ago and stopped seeing my therapist. I recently have bee... http:// bit.ly/17pEV7V;;;;3.73E+17;https://twitter.com/ptsdforum/status/373339975787368448
ptsdforum;30/08/2013 13:10;0;0;Hi, I Was Recently Diagnosed After A Violent Assault: Hi, I'm new here. Was recently diagnosed with PTSD foll... http:// bit.ly/171RDUc;;;;3.73E+17;https://twitter.com/ptsdforum/status/373311646925463552
COVVHA;29/08/2013 07:30;0;0;Hi,my name is Jessica and I have a question. I was diagnosed with PTSD two years ago and I 'm thinking about... http:// fb.me/31oyrDYpW;;;;3.73E+17;https://twitter.com/COVVHA/status/372863701478830082
Coke_and_redruM;28/08/2013 06:46;0;0;@meowie_wowwie You're still young though. When i was your age i was in therapy twice a week and diagnosed with PTSD and depression;;@meowie_wowwie;;3.72E+17;https://twitter.com/Coke_and_redruM/status/372490359135543298
DirtRoadFlyin;27/08/2013 12:56;0;0;"#KnowYourAnon Ever since my sister was diagnosed when I was 11 and she was 5; I was diagnosed with severe paranoia and PTSD .";;;#knowyouranon;3.72E+17;https://twitter.com/DirtRoadFlyin/status/372220977297362945
Kristina_415;22/08/2013 14:38;0;1;I was also diagnosed with depression and PTSD many years ago but I'm not trying to get a million people to feel sorry for me #SubTweet;;;#subtweet;3.70E+17;https://twitter.com/Kristina_415/status/370434844364640258
garrity13;22/08/2013 03:19;0;1;@realnortheast @AlfTonksPieshop @TimetoChange definitely not I was diagnosed with PTSD when I left the army strugled to deal with life.;;@realnortheast @AlfTonksPieshop @TimetoChange;;3.70E+17;https://twitter.com/garrity13/status/370263961419399168
StCrad;22/08/2013 00:57;0;0;@ptsdcycletour No traumas, I was diagnosed with PTSD 7 years ago anything to help;;@ptsdcycletour;;3.70E+17;https://twitter.com/StCrad/status/370228153656287232
ronimompiche;22/08/2013 00:55;0;0;When I was diagnosed with #BipolarDisorder and #PTSD I suddenly understood everything about my crazy double life. http:// rkthb.co/29941;;;#bipolardisorder #ptsd;3.70E+17;https://twitter.com/ronimompiche/status/370227769533165568
kerrybear7;21/08/2013 10:24;1;1;@AstoriaFilmCo @alchemission @themattdallas Posttraumatic stress disorder ( PTSD ). I was never in military but, was diagnosed with it in 99;;@AstoriaFilmCo @alchemission @themattdallas;;3.70E+17;https://twitter.com/kerrybear7/status/370008485833867264
AmyFarris1492;21/08/2013 05:31;0;0;@JJ9828 @mishacollins Very well done. Thank you. I was recently diagnosed with PTSD . Just being told I have that messed with my head.;;@JJ9828 @mishacollins;;3.70E+17;https://twitter.com/AmyFarris1492/status/369934744986726400
gemgemloulou;20/08/2013 14:47;0;0;@nevharvey talk. I was diagnosed with PTSD when Dad died, but *apparently* the treatment I had (EMDR) wasn't effective. I dunno.;;@nevharvey;;3.70E+17;https://twitter.com/gemgemloulou/status/369712195619143680
DavidNemeyer;20/08/2013 08:15;0;1;@ke7dkg it really pisses me off that they label her with PTSD . In 2008, I was diagnosed with it related to the things I've seen or done..;;@ke7dkg;;3.70E+17;https://twitter.com/DavidNemeyer/status/369613601381699584
MilitarywPTSD;19/08/2013 12:46;0;0;From a member: I was diagnosed with chronic severe ptsd . I am going to school for all things....Yoga instructor.... http:// fb.me/1ksQYLr0K;;;;3.69E+17;https://twitter.com/MilitarywPTSD/status/369319498920108032
be_yourself_316;16/08/2013 05:31;0;0;I was honestly just diagnosed with PTSD . #What;;;#what;3.68E+17;https://twitter.com/be_yourself_316/status/368122839351967744
postpartumprog;15/08/2013 23:58;0;0;MT @TCStream : I was diagnosed with PTSD after my twins came at 27w. URL xojane.com/it-happened-to -me/post-partum-ptsd-post-traumatic-stress  #postpartumPTSD;;@TCStream;#postpartumptsd;3.68E+17;https://twitter.com/postpartumprog/status/368038927263084544
TCStream;15/08/2013 23:54;0;0;@postpartumprog Thanks for sharing this. I was diagnosed with PTSD after my twins came at 27w. URL xojane.com/it-happened-to -me/post-partum-ptsd-post-traumatic-stress ;;@postpartumprog;;3.68E+17;https://twitter.com/TCStream/status/368038036962934784
willcpowell;13/08/2013 15:40;0;0;@drkimholt @BBCPanorama @PatientsFirstUK I was diagnosed with PTSD in1993 but NHS/Gov ensured it was exacerbated by further 20 yrs of LIES!;;@drkimholt @BBCPanorama @PatientsFirstUK;;3.67E+17;https://twitter.com/willcpowell/status/367188833424924672
AO2GEN;13/08/2013 12:08;0;0;I'm a 22 almost 23 year old female living on the south side of Chicago. I was recently diagnosed with PTSD I'm a... http:// fb.me/1MKJcfgE9;;;;3.67E+17;https://twitter.com/AO2GEN/status/367135638845677568
_EnglishRider;13/08/2013 05:21;0;0;I was diagnosed with Major Depressive Disorder and PTSD .;;;;3.67E+17;https://twitter.com/_EnglishRider/status/367033167997587456
hwilliams30;11/08/2013 06:30;0;0;You seem to suffer from HPD. Ever been diagnosed with ...  Nope...just PTSD . I never said I was friends with the... http:// ask.fm/a/5kjf05h2;;;;3.66E+17;https://twitter.com/hwilliams30/status/366325766444683265
hwilliams30;11/08/2013 02:08;0;0;Have you ever been asked to take a mental evaluation?  Yes... I was diagnosed with PTSD in 2005 after returning ... http:// ask.fm/a/5kgak02e;;;;3.66E+17;https://twitter.com/hwilliams30/status/366259658342019072
sdiagorg;09/08/2013 01:36;0;0;Many #victims / #survivors are diagnosed with #ptsd . I was diagnosed with it this time last year and http:// instagram.com/p/cwrwgiiT9J/;;;#victims #survivors #ptsd;3.66E+17;https://twitter.com/sdiagorg/status/365526867777814528
bipolarmedfree;08/08/2013 07:31;0;0;Hello Wanted To Drop In & Introduce Myself My Name Is Tina I Was Diagnosed With Bipolar In 2007, I Also Have PTSD ,... http:// fb.me/QJ9rIJpS;;;;3.65E+17;https://twitter.com/bipolarmedfree/status/365253931862999041
sam_steblerrr;06/08/2013 16:22;0;0;two years ago today I was diagnosed with PTSD (post traumatic stress disorder). it's not only a mental http:// instagram.com/p/cqiW5fhQWp/;;;;3.65E+17;https://twitter.com/sam_steblerrr/status/364662703937167362
ptsdforum;06/08/2013 11:39;0;0;I Hate The Effects Of Ptsd : Wow, a forum I can release my angst. I was diagnosed with PTSD by three different ... http:// bit.ly/15CE7eZ;;;;3.65E+17;https://twitter.com/ptsdforum/status/364591586853650432
Valerie0714;06/08/2013 02:59;0;0;@Lux_vincit I was diagnosed with PTSD . Lucky me that I manage well, others don't. Think abt chems & contam. Then eat it, or don't. Choices!;;@Lux_vincit;;3.64E+17;https://twitter.com/Valerie0714/status/364460687327641602
Jansen_Leaks;05/08/2013 15:46;0;0;During the project I was diagnosed with #ptsd Causes include exposure to real or threatened death, injury, or sexual violence. #Devastating;;;#ptsd #devastating;3.64E+17;https://twitter.com/Jansen_Leaks/status/364291266407698433
BKate6696;03/08/2013 23:07;0;0;@therealnicebrit Well I was diagnosed with PTSD amongst other thins b4 he even came along. I left/chucked him out many times. 15 years mess.;;@therealnicebrit;;3.64E+17;https://twitter.com/BKate6696/status/363677427320365056
HealthyPlace;03/08/2013 00:31;3;0;RT @debbiepalm44 : I've been diagnosed with PTSD , depression, anxiety b/c I was bullied, abused & flooded by others.;;@debbiepalm44;;3.63E+17;https://twitter.com/HealthyPlace/status/363336335395790848
debbiepalm44;03/08/2013 00:30;0;0;@HealthyPlace I've been diagnosed with PTSD , depression, anxiety b/c I was bullied & abused & flooded by #Langley Twp staff & @polygonhomes;;@HealthyPlace @polygonhomes;#langley;3.63E+17;https://twitter.com/debbiepalm44/status/363336135214247936
Joe_Schmucc;02/08/2013 23:31;0;0;@fredwimpy I was diagnosed with PTSD in 2005. I've purchased two firearms in California - so two background checks - in the last 3 yrs.;;@fredwimpy;;3.63E+17;https://twitter.com/Joe_Schmucc/status/363321097661333504
brxnna_jpg;02/08/2013 13:35;0;0;@CarrieEckles I was diagnosed with depression at 11. Come to find out, I have PTSD too.;;@CarrieEckles;;3.63E+17;https://twitter.com/brxnna_jpg/status/363171185485295616
MaxineSpeechley;28/07/2013 05:48;0;0;@NewTwinsDad I know the feeling i was diagnosed with ptsd before Xmas, emergency c section dye to kidney & liver failure, seen pschologist &;;@NewTwinsDad;;3.61E+17;https://twitter.com/MaxineSpeechley/status/361241753275219968
COVVHA;26/07/2013 11:44;1;0;Have you heard of TRE? it stands for Trauma Releasing Exercises. I was diagnosed with severe PTSD and this saved... http:// fb.me/SnpUpt5v;;;;3.61E+17;https://twitter.com/COVVHA/status/360606478626856962
COVVHA;26/07/2013 09:07;0;0;I was diagnosed with PTSD at the age of 13, after spending a lifetime of cruelty in the foster care system of... http:// fb.me/6obQxhyyv;;;;3.61E+17;https://twitter.com/COVVHA/status/360566980945788929
Ayee_Bruh;25/07/2013 06:40;0;0;earlier today I was diagnosed with PTSD .;;;;3.60E+17;https://twitter.com/Ayee_Bruh/status/360167600690438144
elvisknievil;25/07/2013 01:20;0;4; @BigSixxRaven : I say I was DIAGNOSED with PTSD-but that isn't Who I am and I Intend to Live a Full Productive Life with it!cheers to that;;@BigSixxRaven;;3.60E+17;https://twitter.com/elvisknievil/status/360087181102030850
pkgif4;25/07/2013 01:19;0;1;@Signatures4S @elvisknievil I say I was DIAGNOSED with PTSD-but that isn't Who I am and I Intend to Live a Full Productive Life with it!;;@Signatures4S @elvisknievil;;3.60E+17;https://twitter.com/pkgif4/status/360086728264007680
whittlovesun;24/07/2013 16:43;0;0;Oh, I was diagnosed with an anxiety disorder now, as well as some PTSD ...You can't come at me quickly or I'll have a panic attack. :O;;;;3.60E+17;https://twitter.com/whittlovesun/status/359957089319268353
davidhoffneriv;23/07/2013 20:34;0;0;@lostsouleh yeah....... i was diagnosed with PTSD last year.;;@lostsouleh;;3.60E+17;https://twitter.com/davidhoffneriv/status/359652835526316034
pseudodeviant;23/07/2013 00:14;0;0;You may or may not be aware that last year I was told that as well as PTSD I was being diagnosed with a personality disorder.;;;;3.59E+17;https://twitter.com/pseudodeviant/status/359345597079240704
Loki_n_friends;22/07/2013 10:39;0;0;(C) to tell my mom what was happening to me. It tore apart my family because the man was my older cousin. At 9 I was diagnosed with PTSD;;;;3.59E+17;https://twitter.com/Loki_n_friends/status/359140634176663552
MarineSergeant1;22/07/2013 00:06;0;0;I was just diagnosed with PTSD at the VA. Hope other vets will seek the help they deserve;;;;3.59E+17;https://twitter.com/MarineSergeant1/status/358981336691773440
BenArcherAuthor;18/07/2013 04:48;0;1;No shit, Sherlock! When I think of all the opportunities I had to be diagnosed with #PTSD when I was still young. But no. Hence my mission..;;;#ptsd;3.58E+17;https://twitter.com/BenArcherAuthor/status/357602731176890368
LifestyleBitch;17/07/2013 22:31;0;0;Bitch Vent (email from a fan): I am a wife, mother and a Veteran. I was recently diagnosed with PTSD . I struggle... http:// fb.me/1tvAXB9Bi;;;;3.58E+17;https://twitter.com/LifestyleBitch/status/357507762894278656
KittyL29;16/07/2013 04:21;0;0;@kykaree #PTSD is just awful :( I was diagnosed with this shortly after Joseph died x;;@kykaree;#ptsd;3.57E+17;https://twitter.com/KittyL29/status/356871224388882433
gjpaterson;16/07/2013 00:56;0;0;When I was first diagnosed with Psycho Neurosis in 1981 I was told Only Americans got PTSD  By A Psychiatrist;;;;3.57E+17;https://twitter.com/gjpaterson/status/356819540644069377
SalivaVic;13/07/2013 17:42;0;0;When I was diagnosed with PTSD & mild ADHD & told my moms she was like what do all those letters mean? So cute.;;;;3.56E+17;https://twitter.com/SalivaVic/status/355985669279072257
harleypyrate02;11/07/2013 13:45;0;0;@iowemysoul I was diagnosed with PTSD many years ago.Several diagnosed me with Depression and that was it.1 Smart Doctor told me do this>;;@iowemysoul;;3.55E+17;https://twitter.com/harleypyrate02/status/355201279481491456
19delta4life;10/07/2013 09:51;0;0;@chapMANIA_ I was diagnosed with PTSD that day;;@chapMANIA_;;3.55E+17;https://twitter.com/19delta4life/status/354779757801517056
JennGriff_WTR;10/07/2013 03:12;1;1;AMEN!!! After I was diagnosed with #PTSD , my OB/GYN, surgeon, neurologist, physical therapist, & shrink all worked 2gether @MaralynBurstein;;@MaralynBurstein;#ptsd;3.55E+17;https://twitter.com/JennGriff_WTR/status/354679473993564160
susieairheart;09/07/2013 00:35;0;0;@findingmyhappy When I was diagnosed with PTSD my doctor told me to keep up the running. Said it worked just as good as the meds :);;@findingmyhappy;;3.54E+17;https://twitter.com/susieairheart/status/354277611058376704
abrewi3010;08/07/2013 22:16;0;0;@MelllBe I was diagnosed with chronic gout in my hands/lower back about 4 years ago & PTSD Osteoarthritis from a rock climbing fall.;;@MelllBe;;3.54E+17;https://twitter.com/abrewi3010/status/354242655145836545
_IAmThawing;06/07/2013 12:20;0;0;So I talked to my old therapist & she told me that I was diagnosed with PTSD . Thanks Mom, you've damaged my life in another way;;;;3.53E+17;https://twitter.com/_IAmThawing/status/353367763378651137
stradlemonkey;06/07/2013 09:01;0;0;@ArmyGuyGeorgia @delldarla I've been on celexa, didn't like it! I was recently diagnosed with PTSD - fight or flight kicks in too often.;;@ArmyGuyGeorgia @delldarla;;3.53E+17;https://twitter.com/stradlemonkey/status/353317816843243520
MrScottMcIntyre;02/07/2013 14:22;0;0;@Pandas_uk I was diagnosed with PTSD and have been blogging about it. I hope you can have a read. http:// littlesthoboblog.wordpress.com/2013/06/21/wai tin-on-a-sunny-day/  #youarenotalone;;@Pandas_uk;#youarenotalone;3.52E+17;https://twitter.com/MrScottMcIntyre/status/351948933473374209
SirPuffAlot_JLR;01/07/2013 11:10;0;0;Would you believe me if I said I was diagnosed with ptsd ? I wouldn't either.;;;;3.52E+17;https://twitter.com/SirPuffAlot_JLR/status/351538329533161475
WomenSurviving;25/06/2013 04:15;0;0;After years of physical,psychological abuse I was diagnosed as PTSD . 2 yrs later i was diagnosed with Bi Polar disorder.I'm BPD but FREE!;;;;3.49E+17;https://twitter.com/WomenSurviving/status/349259501653852160
RebeccaKGordon;23/06/2013 06:34;0;0;@MitchyD @mikeyface Thank u for this tweet. After a life threatening MVA I was diagnosed with PTSD , acute depression & agoraphobia. Ur lucky;;@MitchyD @mikeyface;;3.49E+17;https://twitter.com/RebeccaKGordon/status/348569650705092608
Redregon;20/06/2013 02:57;0;0;@frisbyrat funny thing, that addiction was caused BY my doctor in the first place ( i was put on them when first diagnosed with PTSD );;@frisbyrat;;3.47E+17;https://twitter.com/Redregon/status/347428004131115009
DennisGriffin2;18/06/2013 23:37;0;0;I Was Diagnosed With OOCD, PTSD ,DEPRESSION,ANXIETY,The List Goes On And On,90% Of All Of This Is Just Being Normal,Concentration,Control !;;;;3.47E+17;https://twitter.com/DennisGriffin2/status/347015285523484673
SmilesPyles;16/06/2013 01:18;0;0;I was diagnosed with PTSD;;;;3.46E+17;https://twitter.com/SmilesPyles/status/345953357577461761
bubbleeyed;14/06/2013 04:53;0;0;@Claudie4 @Bob__Frank @Lenihil nut like you Bob I was diagnosed with PTSD and it changed me forever;;@Claudie4 @Bob__Frank @Lenihil;;3.45E+17;https://twitter.com/bubbleeyed/status/345282869922512896
TheHotSpotGear;10/06/2013 15:04;0;0;whats gonna happen when the story comes out on how i was diagnosed with ptsd ... its already makin ya'll look like a$$'$..<3;;;;3.44E+17;https://twitter.com/TheHotSpotGear/status/343986897904885760
