username;date;retweets;favorites;text;geo;mentions;hashtags;id;permalink
TheAirportAspie;17/03/2015 06:04;0;1;@Positivethinka that is true. When I was diagnosed with PTSD I found that no is perfect. And accept other ppl;;@Positivethinka;;5.78E+17;https://twitter.com/TheAirportAspie/status/577591413484879872
brooke_victory;15/03/2015 20:25;0;0;Diagnosed with PTSD at a psych ward in January after I was beaten almost to death but I mean if you know better cunt then open your mouth;;;;5.77E+17;https://twitter.com/brooke_victory/status/577083271244316672
TheodoreVolgoff;13/03/2015 18:01;0;0;@BeckleyResearch @jacobsullum In 2006 I was diagnosed with PTSD . 6 magic truffles trips in the past year has cured it.;;@BeckleyResearch @jacobsullum;;5.76E+17;https://twitter.com/TheodoreVolgoff/status/576322268793569280
jonscott81;12/03/2015 23:51;0;1;Great conversation about #PTSD now on Diane Rehm's show @wfyi . I was diagnosed with it from a car wreck. Can't imagine having it post-war.;;@wfyi;#ptsd;5.76E+17;https://twitter.com/jonscott81/status/576047896853929984
DuarteSuzanne;11/03/2015 00:40;0;0;I forgot to mention that after the events in Orlando I came back to Dallas and was seeing a psychiatrist. I was diagnosed with PTSD;;;;5.75E+17;https://twitter.com/DuarteSuzanne/status/575335507355291648
BehindRedSerge;07/03/2015 08:50;2;3;Janet, I was diagnosed with PTSD in July 2012. I was in a very dark place after my brother took his life and my... http:// fb.me/2YhiAZAWP;;;;5.74E+17;https://twitter.com/BehindRedSerge/status/574009226030350336
TheAirportAspie;07/03/2015 05:02;0;1;@NireBryce @rsocialskills @tzbeck I was diagnosed with everything before I finally got the PTSD diagnoses.;;@NireBryce @rsocialskills @tzbeck;;5.74E+17;https://twitter.com/TheAirportAspie/status/573951793278808064
alyssatheclown;07/03/2015 04:35;0;1;I was diagnosed with #ADD , #ADHD , #OCD and #PTSD because my psychiatrist hates me.;;;#add #adhd #ocd #ptsd;5.74E+17;https://twitter.com/alyssatheclown/status/573944998883799040
thethirdWisemen;05/03/2015 06:24;0;0;I was diagnosed with PTSD after that had on collision... ain't that bout a bitch;;;;5.73E+17;https://twitter.com/thethirdWisemen/status/573247629150322688
BehindRedSerge;05/03/2015 00:40;2;4;My name is Genny and I have been a RCMP officer since 2004. I was diagnosed with PTSD in 2007 after an on the job... http:// fb.me/26ysj6vAD;;;;5.73E+17;https://twitter.com/BehindRedSerge/status/573161173526425600
EthanNguyen_;02/03/2015 05:09;0;5;I was diagnosed with PTSD last night from Long Boarding;Lake Tapps, WA;;;5.72E+17;https://twitter.com/EthanNguyen_/status/572141553872842752
BehindRedSerge;01/03/2015 05:20;4;1;My name is George. Correctional Service Canada. I was diagnosed with PTSD in 2002. http:// fb.me/7k8CKiDCZ;;;;5.72E+17;https://twitter.com/BehindRedSerge/status/571781936299057155
MostlyMeNotOCD;28/02/2015 04:27;0;1;@SociallyAwks05 I was talking to my oldest daughter today about how lucky she is. She was diagnosed with depression, PTSD & psychosis at 15;;@SociallyAwks05;;5.71E+17;https://twitter.com/MostlyMeNotOCD/status/571406212400619520
Mirathagawd;27/02/2015 02:41;0;0;Here's a throwback... Last year before I was diagnosed with PTSD . Look how nice my body was here. pic.twitter.com/5SGGdf7NfC;;;;5.71E+17;https://twitter.com/Mirathagawd/status/571017273806327809
deanesmay;26/02/2015 20:42;0;0;@The_Loki_Jotunn @CultOfVivian @Aeluron1989 I was recently diagnosed with PTSD , and it's made me uncomfortable because of those people.;;@The_Loki_Jotunn @CultOfVivian @Aeluron1989;;5.71E+17;https://twitter.com/deanesmay/status/570926785040420865
ProjctBarefaced;25/02/2015 22:27;0;1;Being bullied I was diagnosed with severe major depression, anxiety and panic disorder, ptsd . I was sick All of the time. I prayed much;;;;5.71E+17;https://twitter.com/ProjctBarefaced/status/570590884447838208
lexeme;23/02/2015 19:50;0;0;I was recently diagnosed with PTSD by a psychiatrist, which was caused by childhood physical and emotional abuse, do not hit your kids;;;;5.70E+17;https://twitter.com/lexeme/status/569826672909758464
ptsdforum;22/02/2015 03:52;0;0;Hi-Hi I m new here. I was recently diagnosed with ptsd and I really need to talk to someone abou URL myptsd.com/c/threads/hi.5 1267/ ;;;;5.69E+17;https://twitter.com/ptsdforum/status/569223132420161536
LittleWitchSeed;20/02/2015 19:15;0;0;Y'know...I forgot I was diagnosed with PTSD until you mentioned war veterans...if it wasn't for you I wouldn't know what war I'm fighting.;;;;5.69E+17;https://twitter.com/LittleWitchSeed/status/568730622702845953
DioneOfficial;19/02/2015 04:35;0;0;FYI, I was actually diagnosed with #HyperArousal as part of #PTSD last year!I also have been attending therapy sessions over the past 6months;;;#hyperarousal #ptsd;5.68E+17;https://twitter.com/DioneOfficial/status/568146724788801536
grneyedmonster;15/02/2015 14:41;0;0;Anonymous said: tw rape i guess. i was recently diagnosed with ptsd but i don't know if it's possible to... http:// tmblr.co/ZITcdt1dRRKSZ;;;;5.67E+17;https://twitter.com/grneyedmonster/status/566849830300168192
VividRicky;14/02/2015 21:21;0;0;@PetrieHoskenLBC @LBC My teen behaviour/moods was teen angst with peers. Wasn't until years later in my 20's I was diagnosed with #PTSD ...;;@PetrieHoskenLBC @LBC;#ptsd;5.67E+17;https://twitter.com/VividRicky/status/566587982304772096
NichBerlin;13/02/2015 12:34;0;0;PTSD is nothing to fuck around with. And tons of people have it without knowing it. I was diagnosed with it when I was 18.;;;;5.66E+17;https://twitter.com/NichBerlin/status/566093022191190017
ptsdforum;13/02/2015 07:54;0;0;Waiting List For Emdr-IN 1998 when I was first diagnosed with PTSD relating t URL myptsd.com/c/threads/wait ing-list-for-emdr.50926/ ;;;;5.66E+17;https://twitter.com/ptsdforum/status/566022579161677826
WarriorsLanding;13/02/2015 04:37;0;0;I was diagnosed with ptsd on the 27th of July 2011 a few months after I was brutally attacked, I was interviewed... http:// fb.me/6FlUghypi;;;;5.66E+17;https://twitter.com/WarriorsLanding/status/565972996029169665
MilitarywPTSD;09/02/2015 02:44;5;5;From a member: I was diagnosed with PTSD back in 2005. I got out 2006 need to see va for help my problem is all... http:// fb.me/2kQh0baxL;;;;5.64E+17;https://twitter.com/MilitarywPTSD/status/564495055118147585
gleekpaula;07/02/2015 06:43;0;0;I was diagnosed with Bipolar II, PTSD , MDD and Anxiety. I watched Glee and for one hour a week I could feel that it was ok to be different.;;;;5.64E+17;https://twitter.com/gleekpaula/status/563830350502035456
AiraBiteThat;06/02/2015 07:33;0;0;@ChrisStargazer @Alyssa_Milano dood ive had ptsd 3times. when i was 19 i was diagnosed with the lvl of vietnam vets! Stress kills Nerves;;@ChrisStargazer @Alyssa_Milano;;5.63E+17;https://twitter.com/AiraBiteThat/status/563480599982116864
SoljaBetty;05/02/2015 19:59;0;0;@ollyfayers ha! True! I don't have clinical depression but have experienced extraordinarily bleak periods. I was diagnosed with PTSD & was >;;@ollyfayers;;5.63E+17;https://twitter.com/SoljaBetty/status/563305982798082048
colderdayz15;05/02/2015 03:12;0;0;@SAVEHICNO1 @megahealth_ anytime Mike. Keep in touch. FYI I was diagnosed with severe PTSD job related. Been in Law Enforcement for 20 yrs.;;@SAVEHICNO1 @megahealth_;;5.63E+17;https://twitter.com/colderdayz15/status/563052577408163840
USMCVeteran1;04/02/2015 23:16;0;0;@MilitarywPTSD I was diagnosed with PTSD depression anxiety and I screwed up and was deported now I have no medical treatment any suggestion;;@MilitarywPTSD;;5.63E+17;https://twitter.com/USMCVeteran1/status/562993137585762304
MilitarywPTSD;04/02/2015 23:15;2;0;From a member: I was diagnosed with PTSD , anxiety, depression and severe paranoia about 2 years ago, 2 years... http:// fb.me/3DQ63Xcg6;;;;5.63E+17;https://twitter.com/MilitarywPTSD/status/562992902692147200
ScottBMcPharlin;03/02/2015 19:36;0;0;@LifesButATweet @MeghanWMcCarthy right on bro I was retroactively diagnosed with PTSD . Some messed up stuff happened when I was 5. Made...;;@LifesButATweet @MeghanWMcCarthy;;5.63E+17;https://twitter.com/ScottBMcPharlin/status/562575340615127042
Joshlee4Rebs;03/02/2015 10:47;0;0;@aceyrob @Jakewim I was recently diagnosed with PTSD . Dr asked you serve? I told her @Jakewim was my center, she understood completely!;;@aceyrob @Jakewim @Jakewim;;5.62E+17;https://twitter.com/Joshlee4Rebs/status/562442335167193089
MilitarywPTSD;03/02/2015 02:29;1;0;From a member: This is my first post to such a page. I was diagnosed with what was called severe PTSD years ago.... http:// fb.me/3wOundFA8;;;;5.62E+17;https://twitter.com/MilitarywPTSD/status/562316990652907520
bipolar_ptsd;31/01/2015 01:37;0;0;@GeniusPhx Lamictal is a great mood stabilizer. I was on it for PTSD before I was diagnosed with bipolar. Helps with bad depression swings;;@GeniusPhx;;5.61E+17;https://twitter.com/bipolar_ptsd/status/561216738034192384
erinfoster614;30/01/2015 23:24;0;0;@SistersHeartSBH I was diagnosed with PTSD from dealing with events related to son's HLHS. Hard to treat when you're still in the situation.;;@SistersHeartSBH;;5.61E+17;https://twitter.com/erinfoster614/status/561183301235638272
scienceg33k;29/01/2015 12:15;0;0;1997 I was hit in the head by a discus at a Track Meet. Diagnosed with PTSD , I still have physical & emotional side effects. #BellLetsTalk;;;#bellletstalk;5.61E+17;https://twitter.com/scienceg33k/status/560652410192814081
kaitlyn_zoller;29/01/2015 12:07;0;3;Almost 3 years ago I was diagnosed with Bipolar Disorder, Generalized Anxiety Disorder, And PTSD . I'm on my way to recovery.! #BellLetsTalk;;;#bellletstalk;5.61E+17;https://twitter.com/kaitlyn_zoller/status/560650341461815297
PhonseJessome;29/01/2015 10:03;24;55;I was first diagnosed with Complex PTSD after a bad night in 2007. I've been successfully hiding it ever since. I guess that ends now. #talk;;;#talk;5.61E+17;https://twitter.com/PhonseJessome/status/560619171181264896
Michelleb3471;29/01/2015 09:56;2;0;I never knew what PTSD was until I was diagnosed with cancer #truth #BellLetsTaIk;;;#truth #bellletstaik;5.61E+17;https://twitter.com/Michelleb3471/status/560617565060214784
Cleg_xoxo;29/01/2015 08:45;1;0;My struggle with mental illness started after an accident and I was diagnosed with PTSD . Very thankful for #BeIILetsTalk #wearenotalone;;;#beiiletstalk #wearenotalone;5.61E+17;https://twitter.com/Cleg_xoxo/status/560599554681106435
Darth_Pingu;29/01/2015 07:27;2;2;I was officially diagnosed with depression and PTSD nearly 8 years ago, but I believe it's been with me much longer (2 of ?) #BellLetsTalk;;;#bellletstalk;5.61E+17;https://twitter.com/Darth_Pingu/status/560580064421875713
SaquoiaMcKinnon;29/01/2015 05:34;1;1;I was diagnosed with PTSD at the age of 11. I was told to just forget about what happened (I watched my dad get run over) #BellLetsTalk;;;#bellletstalk;5.61E+17;https://twitter.com/SaquoiaMcKinnon/status/560551528592076801
Kurisama91;29/01/2015 05:32;3;0;And what I was diagnosed with was PTSD . Not the light PTSD , but the jump and wake up in the morning at a noise panicking type. #BellLetsTalk;;;#bellletstalk;5.61E+17;https://twitter.com/Kurisama91/status/560550947454083072
gerglesworth;29/01/2015 05:27;1;0;"last year I was diagnosed with general, social and panic anxiety, depression, PTSD , and alcoholism. come at me! #BellLetsTalk";;;#bellletstalk;5.61E+17;https://twitter.com/gerglesworth/status/560549626076733440
RachellyWheaton;29/01/2015 05:20;1;0;When I was 14 and diagnosed with PTSD and a panic disorder, I believed I would be broken for the rest of my life. #BellLetsTaIk;;;#bellletstaik;5.61E+17;https://twitter.com/RachellyWheaton/status/560547896215732225
angelastacey_77;29/01/2015 04:05;0;0;I was diagnosed with PTSD ,Depression andAnxiety few months http:// ago.Today is #BellLetsTalkDay lets stop the stigma of mental illness;;;#bellletstalkday;5.61E+17;https://twitter.com/angelastacey_77/status/560529050850971649
slotherella32;29/01/2015 03:40;0;0;#lrt um thank you! I was diagnosed with PTSD and my mom gave me a dirty look and didn't believe it;;;#lrt;5.61E+17;https://twitter.com/slotherella32/status/560522827401801728
thatjosh;29/01/2015 00:53;2;4;I struggled with depression most of my life.After my mom died when I was 16 I was diagnosed with PTSD and clinical depression #BellLetsTaIk;Hamilton, Ontario;;#bellletstaik;5.60E+17;https://twitter.com/thatjosh/status/560480818725150722
GamersAstroZone;29/01/2015 00:24;0;0;@crazyindapeg Wow dude I was diagnosed with PTSD and Depression I dont think its so much a mental illness it's more like bad situations;;@crazyindapeg;;5.60E+17;https://twitter.com/GamersAstroZone/status/560473577301221376
queen_dweb;28/01/2015 23:55;1;1;#BellLetsTaIk because when I tell people I was / diagnosed/ with PTSD they tell me I haven't gone through any trauma like they know my life.;;;#bellletstaik;5.60E+17;https://twitter.com/queen_dweb/status/560466184127008768
anachristena;28/01/2015 23:15;0;0;#BellLetsTalk My most debilitating time was several years ago. I was diagnosed with PTSD . Lets not sweep MH under rug keep the conversation;;;#bellletstalk;5.60E+17;https://twitter.com/anachristena/status/560456027104358400
slayinthedragon;28/01/2015 22:04;17;22;At 21 I was diagnosed with #PTSD & barely talked about it. I felt alone, scared and angry. But I wasn't alone. Neither are u #BellLetsTaIk;;;#ptsd #bellletstaik;5.60E+17;https://twitter.com/slayinthedragon/status/560438332443086849
thebeergypsy;28/01/2015 20:42;8;4;I always knew I was different. 2009 I was diagnosed with MDD & PTSD and started getting help. I still struggle but gets easier #BellLetsTalk;;;#bellletstalk;5.60E+17;https://twitter.com/thebeergypsy/status/560417726809010176
5iveforFighting;28/01/2015 12:51;6;5;#BellLetsTalk because a year ago I was diagnosed with PTSD from an abusive relationship.;;;#bellletstalk;5.60E+17;https://twitter.com/5iveforFighting/status/560299205667737600
EliseMcGhee;28/01/2015 08:30;0;0;@fightermorgan Hello Bailey~ Yes, I was diagnosed with PTSD . Do you have it dear? If we give in, our abuser wins has won. @EliseMcGhee;;@fightermorgan @EliseMcGhee;;5.60E+17;https://twitter.com/EliseMcGhee/status/560233541498601473
ptsdforum;27/01/2015 21:01;1;0;Does The Hatred Ever Go Away?- I was only diagnosed with PTSD about 3 m URL myptsd.com/c/threads/does -the-hatred-ever-go-away.50485/ ;;;;5.60E+17;https://twitter.com/ptsdforum/status/560059936307437568
adelasteria;26/01/2015 11:50;0;0;@jonasweaver my psych told me she thinks I have PTSD and anxiety but I don't think I was officially diagnosed with anything;;@jonasweaver;;5.60E+17;https://twitter.com/adelasteria/status/559558928887869442
insanephotos22;26/01/2015 07:40;1;1;@GothamKnight05 @TammaraMaiden1 @radiocorps @HarryThetech76 I was diagnosed with PTSD however I sought help and took necessary steps.;;@GothamKnight05 @TammaraMaiden1 @radiocorps @HarryThetech76;;5.59E+17;https://twitter.com/insanephotos22/status/559496012960907264
Omars510;25/01/2015 15:35;0;1;One year ago, I was diagnosed with PTSD . I lost two best friends and I felt guilty most of the time. Glad that I have overcomed most of it.;;;;5.59E+17;https://twitter.com/Omars510/status/559253158623727616
ProjectSabs;23/01/2015 00:56;0;0;Yesterday I was diagnosed with Major Depressive Disorder and PTSD . So I guess life is just gonna be more interesting for a while.;;;;5.58E+17;https://twitter.com/ProjectSabs/status/558307347781517313
Gnarsenic;21/01/2015 14:42;0;0;I was diagnosed with PTSD not some bullshit self diagnose.;;;;5.58E+17;https://twitter.com/Gnarsenic/status/557790423880835072
ptsdresolution;20/01/2015 16:34;4;2;I am an ex soldier and a serving Police Officer in the UK. I was diagnosed with having PTSD in 2007 after... http:// fb.me/1UpxQyLYQ;;;;5.57E+17;https://twitter.com/ptsdresolution/status/557456220928622592
mamarocks54;20/01/2015 03:17;0;0;@kellyapritchard PTSD is not fun. I was diagnosed with it after I found my son when he died.Ive battled my own anger ever since.;;@kellyapritchard;;5.57E+17;https://twitter.com/mamarocks54/status/557255668785479680
MilitarywPTSD;19/01/2015 09:51;1;0;From a member: I suffered a traumatic injury while serving overseas and was diagnosed with PTSD . I was very hard... http:// fb.me/3txCNPFEO;;;;5.57E+17;https://twitter.com/MilitarywPTSD/status/556992331816382464
59b881396b70425;18/01/2015 08:00;0;0;@CDiabetesInfo I was diagnosed with PTSD , major depression and anxiety attacks. And food became my addiction, especially chocolate.;;@CDiabetesInfo;;5.57E+17;https://twitter.com/59b881396b70425/status/556602053657911296
GrecoPride;16/01/2015 12:21;0;0;@KEEMSTARx Bad Trip was so bad that after playing it i was diagnosed with PTSD . #DidIJustSayThat ? #YesIdid #MyMomsALawyer #NeverForget;;@KEEMSTARx;#didijustsaythat #yesidid #mymomsalawyer #neverforget;5.56E+17;https://twitter.com/GrecoPride/status/555942794221867009
MilitarywPTSD;14/01/2015 23:14;2;0;From a member: Maybe you can post I was discharged with a personality disorder in 2000 later diagnosed with ptsd ... http:// fb.me/1JC8g6VfA;;;;5.55E+17;https://twitter.com/MilitarywPTSD/status/555382421164949504
beanzefron;12/01/2015 07:16;0;0;@alienelfthing cradles u. tbh yesterday i tried to explain to my dad why i was almost diagnosed with ptsd and he was like;;@alienelfthing;;5.54E+17;https://twitter.com/beanzefron/status/554416481065517056
MeshedEtch;11/01/2015 08:11;0;0;@FFDP I was diagnosed with PTSD at age 8 & we want Denver International Airport. pic.twitter.com/Rrx3YYOrix;;@FFDP;;5.54E+17;https://twitter.com/MeshedEtch/status/554068034298458112
ptsdforum;10/01/2015 12:56;1;0;"Hello Hello; I was diagnosed with complex PTSD in 2006, and it was something of a welcome relief after more than 40 URL myptsd.com/c/threads/hell o.50086/ ";;;;5.54E+17;https://twitter.com/ptsdforum/status/553777292754034688
ptsdforum;10/01/2015 07:56;0;0;Should I Trust Him? Hello, I was never diagnosed with PTSD by a professional psychologist. I was raped this summer URL myptsd.com/c/threads/shou ld-i-trust-him.50081/ ;;;;5.54E+17;https://twitter.com/ptsdforum/status/553701883853156352
yolivocals;10/01/2015 06:56;0;0;I along with many other had bouts with mental health issues as a result of abuse. I was diagnosed with PTSD in... http:// fb.me/71t9lXFMW;;;;5.54E+17;https://twitter.com/yolivocals/status/553686688439205888
ptsdforum;10/01/2015 05:58;0;0;Sign Around My Neck I m so angry and frustrated. In 2012 I was diagnosed with having PTSD and since diagnosed with URL myptsd.com/c/threads/sign -around-my-neck.50077/ ;;;;5.54E+17;https://twitter.com/ptsdforum/status/553672108094816256
ade0etreqe;09/01/2015 20:34;0;1;Yesterday I was officially  diagnosed? With PTSD .....;;;;5.54E+17;https://twitter.com/ade0etreqe/status/553530229587984384
ptsdforum;09/01/2015 14:00;0;0;Hello Hello all. I was diagnosed with PTSD approx 5 years ago. Mine was triggered by several stressful events in my URL myptsd.com/c/threads/hell o.50068/ ;;;;5.53E+17;https://twitter.com/ptsdforum/status/553431042984783872
BehindRedSerge;09/01/2015 09:46;2;1;We understand PTSD When I was diagnosed with PTSD , it was probably the most frustrating time of my life. Not... http:// fb.me/6X79MtBt9;;;;5.53E+17;https://twitter.com/BehindRedSerge/status/553367097771048960
clumsy_ash;09/01/2015 00:04;0;0;@RealSway I believe in medicinal marijuana. I was diagnosed with PTSD and it truly helps me.. It has even helped save children with cancer.;;@RealSway;;5.53E+17;https://twitter.com/clumsy_ash/status/553220727998910464
tinalcarr69;08/01/2015 04:15;1;4;@Neither4evr Yes. I was diagnosed with BPD,Tri-polar Disorder, & PTSD . I know that #JodiArias is not any of those. She suffers from lying.;;@Neither4evr;#jodiarias;5.53E+17;https://twitter.com/tinalcarr69/status/552921445526147074
ptsdforum;07/01/2015 19:05;0;0;Childhood Abuse - Still Haunts. I was diagnosed with PTSD over a decade and a half ago. Last year my Borderline mom URL myptsd.com/c/threads/chil dhood-abuse-still-haunts.50010/ ;;;;5.53E+17;https://twitter.com/ptsdforum/status/552782977751867393
ptsdforum;07/01/2015 08:02;0;0;What's On Your Top Ten List ? After I was diagnosed with PTSD I was having major issues with feeling peace in mysel URL myptsd.com/c/threads/what s-on-your-top-ten-list.45122/ ;;;;5.53E+17;https://twitter.com/ptsdforum/status/552616219334168576
ptsdforum;07/01/2015 03:21;0;0;Bothered By Recent Suicides I m former EMS, fired this year by my employer. I was diagnosed with PTSD in 2008 and h URL myptsd.com/c/threads/both ered-by-recent-suicides.46424/ ;;;;5.53E+17;https://twitter.com/ptsdforum/status/552545560969105411
debatefordays;06/01/2015 01:57;0;1;Anonymous said: I was just diagnosed with PTSD and I want to quit debate so I can focus on myself for a... http:// tmblr.co/Z2sOPw1ZtQvZF;;;;5.52E+17;https://twitter.com/debatefordays/status/552162017508077568
Reddit4Savages;05/01/2015 10:21;0;3;"Six months ago, I was diagnosed with psychedelic-induced PTSD ; so, I've be http:// bit.ly/1AaNH7W [ http:// redd.it/2raa54 ] #pnaut @joerogan";;@joerogan;#pnaut;5.52E+17;https://twitter.com/Reddit4Savages/status/551926321056849920
Reddit4DTFHfans;05/01/2015 04:06;1;0;"Six months ago, I was diagnosed with psychedelic-induced PTSD ; so, I http:// bit.ly/1yoKalR [ http:// redd.it/2raa54 ] #pnaut @duncantrussell";;@duncantrussell;#pnaut;5.52E+17;https://twitter.com/Reddit4DTFHfans/status/551831942862471168
rPsychonaut;04/01/2015 23:10;0;0;"Six months ago, I was diagnosed with psychedelic-induced PTSD ; so, I've been channeling tha http:// bit.ly/1AaNH7W [ http:// redd.it/2raa54 ]";;;;5.52E+17;https://twitter.com/rPsychonaut/status/551757454330310657
lobafrz;02/01/2015 18:08;0;0;I was diagnosed with a major depression, anxiety and PTSD regarding the rape... The one I never told anyone about...;;;;5.51E+17;https://twitter.com/lobafrz/status/550956775290462208
MissNena2142;02/01/2015 11:12;0;0;ok so many of you don't know me but 2 months ago I was Diagnosed with depression PTSD and anxiety and If it wasn't for @onedirection i don't;;@onedirection;;5.51E+17;https://twitter.com/MissNena2142/status/550852053137129473
MandyMThompson;31/12/2014 21:14;0;0;Maybe it's the New Year's Eve, I feel like sharing a part of me... I was diagnosed with PTSD last year. Life... http:// fb.me/6ZTURslzU;;;;5.50E+17;https://twitter.com/MandyMThompson/status/550278705118187520
radcrochetqueer;31/12/2014 06:37;0;0;@VanguardVivian I was diagnosed with PTSD less than a year ago, it sucks. @prpltnkr;;@VanguardVivian @prpltnkr;;5.50E+17;https://twitter.com/radcrochetqueer/status/550058156211339266
MarandaDearest;29/12/2014 03:11;0;0;I've taken a break from writing. I was diagnosed with complex- PTSD & I don't think writing is enough. Sometimes it just makes it worse.;;;;5.49E+17;https://twitter.com/MarandaDearest/status/549281597934301186
MilitarywPTSD;29/12/2014 00:03;0;1;From a member: I've never been in the military but my best friend was, He suffers from PTSD . I was diagnosed with ... http:// fb.me/3RHL0EMfZ;;;;5.49E+17;https://twitter.com/MilitarywPTSD/status/549234075173924864
SailorUranus13;28/12/2014 05:41;0;0;' I Was Diagnosed With PTSD After Divorce' URL huffingtonpost.com/2014/01/07/div orce-post-traumatic-_n_4557481.html  via @HuffPostDivorce;;@HuffPostDivorce;;5.49E+17;https://twitter.com/SailorUranus13/status/548956751198826497
vocaldoge;27/12/2014 11:03;0;0;@PlsFeedTheBear I was diagnosed with ptsd and bipolar II disorder. The medication is helping big time, but I still need lots of therapy.;;@PlsFeedTheBear;;5.49E+17;https://twitter.com/vocaldoge/status/548675448667119616
jjessie107;24/12/2014 10:48;0;0;@thekatbrooks When I was 15 I was diagnosed with ptsd last year I was diagnosed with Lupus and just last I was also diagnos with R.A;;@thekatbrooks;;5.48E+17;https://twitter.com/jjessie107/status/547584523257405440
ptsdforum;24/12/2014 06:00;0;0;Hello From Colorado. You can call me Jester. I was diagnosed with PTSD and Bipolar 1 in May of this year. My therap URL myptsd.com/c/threads/hell o-from-colorado.49722/ ;;;;5.48E+17;https://twitter.com/ptsdforum/status/547512025128378368
nathanwosnack;21/12/2014 13:38;0;0;@pikelet I was diagnosed with Generalized Anxiety Disorder at age 7, and I am recovering from PTSD . Demi really does inspire me. :);;@pikelet;;5.47E+17;https://twitter.com/nathanwosnack/status/546540306045632512
WK_Rodriguez;21/12/2014 13:05;0;1;When I was diagnosed with PTSD last year, she was the first person I told and she told me she was going to be there for me every day;;;;5.47E+17;https://twitter.com/WK_Rodriguez/status/546531812697055232
byepoleher;19/12/2014 13:01;1;0;I was diagnosed with Bipolar II disorder and PTSD .;;;;5.46E+17;https://twitter.com/byepoleher/status/545806128891043840
roenneb;19/12/2014 02:28;0;1;Just got finished with that Calc final... I'm pretty sure I was diagnosed with PTSD;;;;5.46E+17;https://twitter.com/roenneb/status/545646843984891906
MilitarywPTSD;16/12/2014 07:00;0;0;From a member: I Was diagnosed with PTSD and severe anxiety a year and a half ago I have been struggling with it... http:// fb.me/3tw5wpJcN;;;;5.45E+17;https://twitter.com/MilitarywPTSD/status/544627969885757440
TexanBorne;16/12/2014 00:44;0;0;@Godsmack_Music @iHeartRadio I was diagnosed with severe depression at 19 and PTSD at 31/My current age. Still makin' it happen!! #Cheers;;@Godsmack_Music @iHeartRadio;#cheers;5.45E+17;https://twitter.com/TexanBorne/status/544533503858049024
WittySam;15/12/2014 14:44;0;0;@OiSimmo I'm trying not to judge people as I was diagnosed with PTSD after experiencing years of trauma.;;@OiSimmo;;5.44E+17;https://twitter.com/WittySam/status/544382481835626496
CynthiaD227;10/12/2014 10:23;3;6;#Sexabusechat In my 20's I was diagnosed with #PTSD depression, dissociative disorder. worked for years in therapy. now life is awesome.;;;#sexabusechat #ptsd;5.43E+17;https://twitter.com/CynthiaD227/status/542504768652865536
